rate,review
5,"이시국이라서 먼저 주문했었는데요!애기가 넘 좋아해요~~~!밥먹을때만 기다리구 하이포알러제닉 스몰독 먹구나선 발바닥에 발갛게 올라온 습진(?도 좀 가라앉는거 같아서 안심이에요^^담에
이시국이라서 먼저 주문했었는데요!
애기가 넘 좋아해요~~~!
밥먹을때만 기다리구 하이포알러제닉 스몰독 먹구나선 발바닥에 발갛게 올라온 습진(?도 좀 가라앉는거 같아서 안심이에요^^담에 또 구매할게요~~:)"
5,"세번째 주문하는데 여기가 좀 싸게 파네요 부서지지않게 뽁뽁이로 감싸줘서 만족스러워요사료기호성도 좋아 알러지없는 아이까지 이거밖에 안먹으려하네요 좀 더 대용량이 나오면 좋겠어요 세마
세번째 주문하는데 여기가 좀 싸게 파네요 부서지지않게 뽁뽁이로 감싸줘서 만족스러워요
사료기호성도 좋아 알러지없는 아이까지 이거밖에 안먹으려하네요 좀 더 대용량이 나오면 좋겠어요 세마리라 금방 없어져요.."
4,"일단포장이 비닐에와서 당황했어요 다행히 작은알이라 크게부서진건없었지만 좀더신경써주셨음좋겠어요 제가요청한샘플도잘왔고 배송도 보통이고가격저렴하게 잘구매했습니다 항상먹이는거라 기호도는좋
일단포장이 비닐에와서 당황했어요 다행히 작은알이라 크게부서진건없었지만 좀더신경써주셨음좋겠어요 제가요청한샘플도잘왔고 배송도 보통이고가격저렴하게 잘구매했습니다 항상먹이는거라 기호도는좋아요"
5,"평소 피부 알러지가 있어 먹였던 사료인데 말티즈5.5킬로 아이라서 입자가 큰 알갱이 먹이다가 스몰독용으로 바꿨더니 더 잘 먹는거 같네요. 저렴한 가격으로 구입해서 만족스럽고 유통기
평소 피부 알러지가 있어 먹였던 사료인데 말티즈5.5킬로 아이라서 입자가 큰 알갱이 먹이다가 스몰독용으로 바꿨더니 더 잘 먹는거 같네요. 저렴한 가격으로 구입해서 만족스럽고 유통기한도 넉넉합니다
재구매의사 있어요"
4,"곰팡이성 피부염으로 고생하는 아이를 위해 구매를 했는데 첨엔 잘 안먹더니 점점 기호성도 좋아지는것 같고 아직은 잘 모르지만 점점더 호전되길 바랍니다. 다만 가격을 좀 내렸으면 좋겠
곰팡이성 피부염으로 고생하는 아이를 위해 구매를 했는데 첨엔 잘 안먹더니 점점 기호성도 좋아지는것 같고 아직은 잘 모르지만 점점더 호전되길 바랍니다. 다만 가격을 좀 내렸으면 좋겠는데 오르기만 하네요 이제품은.."
5,"항상 이용하는 제품입니다.
1. 알러지 개선2. 강아지가 좋아하는 향과 맛3. 높은 소화흡수력4. 소형견에 적합한 알갱이 크기등 장점이 많은 사료입니다.유통기한도 2021년 10월로 충분합니다.박스포장으로 안전 신속하게 잘 받았습니다.사업 번창하세요."
5,"항상구매하는 제품인데요 저는 �
항상구매하는 제품인데요 저는 한번 꽂히면 그 상품만 죽어라 더 좋은것을 발견할때까지 이네요 ㅋ 나에게 맞지 않는 조금에 불편이나 별로라는 생각이 들면 절대 재구매는 없는~ ㅋ 너무 좋아요 항상구매하는 제품은 할인까지 자주 해주시면 너무 감사하겠네요항상구매하는 제품인데요 저는 한번 꽂히면 그 상품만 죽어라 더 좋은것을 발견할때까지 이네요 ㅋ 나에게 맞지 않는 조금에 불편이나 별로라는 생각이 들면 절대 재구매는 없는~ ㅋ 너무 좋아요 항상구매하는 제품은 할인까지 자주 해주시면 너무 감사하겠네요항상구매하는 제품인데요 저는 한번 꽂히면 그 상품만 죽어라 더 좋은것을 발견할때까지 이네요 ㅋ 나에게 맞지 않는 조금에 불편이나 별로라는 생각이 들면 절대 재구매는 없는~ ㅋ 너무 좋아요 항상구매하는 제품은 할인까지 자주 해주시면 너무 감사하겠네요항상구매하는 제품인데요 저는 한번 꽂히면 그 상품만 죽어라 더 좋은것을 발견할때까지 이네요 ㅋ 나에게 맞지 않는 조금에 불편이나 별로라는 생각이 들면 절대 재구매는 없는~ ㅋ 너무 좋아요 항상구매하는 제품은 할인까지 자주 해주시면 너무 감사하겠네요"
5,"입맛까다로운 아이들은 아니라서 뭐든 잘 먹지만,정량 다 먹고 빈그릇 핥을 정도로 좋아해요.하이포알러제닉 먹인지 넉달정도 되었고식이성알러지때문에 귀가 항상 안좋았는데 붓기도 가라앉고
입맛까다로운 아이들은 아니라서 뭐든 잘 먹지만,
정량 다 먹고 빈그릇 핥을 정도로 좋아해요.
하이포알러제닉 먹인지 넉달정도 되었고
식이성알러지때문에 귀가 항상 안좋았는데
붓기도 가라앉고 많이 좋아졌어요. 강추입니다^^"
5,"9월 2일 결제후 다음날 바로 도착했구요 비싸도 피부때문에 먹이구 있어요 항상 한번에 구매할때 2개씩 구매하네요 ㅠ얼마못가지만 ㅠ강아지들이 잘먹기두 하구 병원에서도 추천 받은 사료
9월 2일 결제후 다음날 바로 도착했구요 비싸도 피부때문에 먹이구 있어요 항상 한번에 구매할때 2개씩 구매하네요 ㅠ얼마못가지만 ㅠ강아지들이 잘먹기두 하구 병원에서도 추천 받은 사료라 꾸준히 먹이고 있습니다!"
5,"병적으로 발바닥을 핥고 온몸을 긁는 아이라매번 재구매해서 먹고있는 사료에요가끔 다른 사료를 먹게되면 반나절만 지나도엄청 긁고 핥고.. 난리도 아니랍니다확실히 알러지, 피부트러블에는
병적으로 발바닥을 핥고 온몸을 긁는 아이라
매번 재구매해서 먹고있는 사료에요
가끔 다른 사료를 먹게되면 반나절만 지나도
엄청 긁고 핥고.. 난리도 아니랍니다
확실히 알러지, 피부트러블에는 효과가 좋은것 같아요"
5,"저렴하게 잘 사서 아주 만족하고 유통기한도 넉넉해서 좋습니다. 한봉지로 15일 먹는데, 매번 사러가기 어렵고 병원에는 여러개 있지도 않았거든요.. 인터넷에서 살 수 있어서 너무 좋
저렴하게 잘 사서 아주 만족하고
유통기한도 넉넉해서 좋습니다.
한봉지로 15일 먹는데,
매번 사러가기 어렵고 병원에는 여러개 있지도 않았거든요.. 인터넷에서 살 수 있어서 너무 좋네요"
1,"사료 자체는 계속 먹이고 있는거라 그렇다 치고 저가 상품도 아니고 포장에 신경써야 해요 하나가 터져셔 왔네요반품 교환 번거로워 그냥 먹지만 택배상자가 세상 얇네요뽁뽁이라도 둘렀으면
사료 자체는 계속 먹이고 있는거라 그렇다 치고
저가 상품도 아니고 포장에 신경써야 해요 하나가 터져셔 왔네요
반품 교환 번거로워 그냥 먹지만 택배상자가 세상 얇네요
뽁뽁이라도 둘렀으면 합니다."
5,"4세 말티즈 알러지체질이라 이 사료만 먹어요. 아주 맛있게 먹고 제품 유통기한도 넉넉하고 무엇보다 1kg 포장은 처음 사봤는데 보관하기 용이해 좋네요. 좋은 가격에 잘 샀어요. 또
4세 말티즈 알러지체질이라 이 사료만 먹어요. 아주 맛있게 먹고 제품 유통기한도 넉넉하고 무엇보다 1kg 포장은 처음 사봤는데 보관하기 용이해 좋네요. 좋은 가격에 잘 샀어요. 또 재구매 하겠습니다. 감사합니다."
5,"판매자님 주말껴서 배송 늦게 될까봐 아이스박스에 넣어주시고 너무 섬세하신것같아요❤덕분에 사료 잘 받았어요알러지때문에 병원에서 처방해준사료예요매우 만족하고있고 기호성도 좋아서 너무
판매자님 주말껴서 배송 늦게 될까봐 아이스박스에 넣어주시고 너무 섬세하신것같아요❤
덕분에 사료 잘 받았어요
알러지때문에 병원에서 처방해준사료예요
매우 만족하고있고 기호성도 좋아서 너무 잘먹네요"
5,"울 강아지 로얄캐닌 완전 환장하게 잘 먹네요;;;성분이 좋은가? 신선한가?원래 밥 주면 놀다가 배고플때 쯤 먹는데이건 주자마자 바로 먹어요...;;;알러지 예방 효과는 아직 모르겠
울 강아지 로얄캐닌 완전 환장하게 잘 먹네요;;;
성분이 좋은가? 신선한가?
원래 밥 주면 놀다가 배고플때 쯤 먹는데
이건 주자마자 바로 먹어요...;;;
알러지 예방 효과는 아직 모르겠음.."
5,"저희 강아지가 피부가 안좋아서 알러제닉으로 바꿨는데 사료에서 특유의 기름기나 냄새가 거의 없고 일반 과자처럼 고소한 냄새가 나서 그런지 너무 잘먹어요 덕분에 저렴하게 잘 구매했습니
저희 강아지가 피부가 안좋아서 알러제닉으로 바꿨는데 사료에서 특유의 기름기나 냄새가 거의 없고 일반 과자처럼 고소한 냄새가 나서 그런지 너무 잘먹어요 덕분에 저렴하게 잘 구매했습니다 번창하세요~^^"
4,"강아지 알러지가 심한데 이걸 먹이니 나아져서 꾸준히 먹입니다. 문제는 애가 사료를 2주만에 해치워버려서 빈번히 구매한다는 것... 비싼만큼 좋은 성분이 있다는 소리겠지요. 오늘도
강아지 알러지가 심한데 이걸 먹이니 나아져서 꾸준히 먹입니다. 문제는 애가 사료를 2주만에 해치워버려서 빈번히 구매한다는 것... 비싼만큼 좋은 성분이 있다는 소리겠지요. 오늘도 허리띠를 졸라맵니다..."
5,"저희집 멍뭉이들 피부질환때문에 가수분해 사료 종류별로 다 먹어보았는데 로얄캐닌이 가장 기호성이 좋네요~ 잘 먹어요! 여기가 가격도 젤 저렴하고 배송도 빨라서 좋아요 자주 주문할게요
저희집 멍뭉이들 피부질환때문에 가수분해 사료 종류별로 다 먹어보았는데 로얄캐닌이 가장 기호성이 좋네요~ 잘 먹어요! 여기가 가격도 젤 저렴하고 배송도 빨라서 좋아요 자주 주문할게요!!"
5,"원래 먹이다가 다들 그러시겠지만 다른 브랜드에 알러지 사료 먹여봐써요 잘 안먹더라고요 가끔 오바이트도하고..그래서 다시 주문해써요 ㅎㅎ대용량이라 조금씩 덜어서 포장해서 먹입니다
원래 먹이다가 다들 그러시겠지만 다른 브랜드에 알러지 사료 먹여봐써요 잘 안먹더라고요 가끔 오바이트도하고..
그래서 다시 주문해써요 ㅎㅎ
대용량이라 조금씩 덜어서 포장해서 먹입니다"
5,"말티즈인데 눈물 때문에 먹이게 되었어요.강아지 눈물을 시간날 때 마다 신경쓰고 닦아주면서 먹이니까산책 할때 만나는 견주들이 어쩜 이렇게 눈 주위가 깨끗하냐고 물어봐요~꾸준히 계속
말티즈인데 눈물 때문에 먹이게 되었어요.
강아지 눈물을 시간날 때 마다
신경쓰고 닦아주면서 먹이니까
산책 할때 만나는 견주들이 어쩜
이렇게 눈 주위가 깨끗하냐고 물어봐요~
꾸준히 계속 먹일 생각입니다."
5,"일단 동물병원에서 추천하니까 믿고 먹일수 있는것 같네요 강아지가 알러지가 좀 있는편인데 이 사료 먹고는 좀 진정이 되는거 같아요 하지만 약이 아니므로 해결책은 될수 없다는점 꼭 알
일단 동물병원에서 추천하니까 믿고 먹일수 있는것 같네요
강아지가 알러지가 좀 있는편인데 이 사료 먹고는 좀 진정이 되는거 같아요 하지만 약이 아니므로 해결책은 될수 없다는점 꼭 알아두기길 바래요"
5,"노견이라 항상 먹여오던 제품인데 요즈음 관절사료와 함께 선식에 섞어서 먹이고 있어요넘 맛나게 잘 먹어주고 건강해진듯 해서 감사해요 다 먹고나면 재구매할께요
노견이라 항상 먹여오던 제품인데 요즈음 관절사료와 함께 선식에 섞어서 먹이고 있어요
넘 맛나게 잘 먹어주고 건강해진듯 해서 감사해요
다 먹고나면 재구매할께요"
5,"사료값이 점점비싸지고 품절도많네요ㅜㅜ..알러지사료라서 처음먹이기시작햇는데맛잇는지 다른사료섞어줘도 이것만골라먹어요안살수도없는 노릇인데 사료값..부담마니되긴하네요그래도 애들이 잘먹으니
사료값이 점점비싸지고 품절도많네요
ㅜㅜ..알러지사료라서 처음먹이기시작햇는데
맛잇는지 다른사료섞어줘도 이것만골라먹어요
안살수도없는 노릇인데 사료값..부담마니되긴하네요
그래도 애들이 잘먹으니까 또구입하께요"
5,"전에 먹던 사료에 눈물이 터져버려서... 맨날 닦아주느라 고생이었는데 이걸로 바꾸자마자 눈물자국까지 싹 사라졌네요. 입이 짧은 애라 매번 사료를 남기는데 이 사료는 항상 싹싹 비워
전에 먹던 사료에 눈물이 터져버려서... 맨날 닦아주느라 고생이었는데 이걸로 바꾸자마자 눈물자국까지 싹 사라졌네요. 입이 짧은 애라 매번 사료를 남기는데 이 사료는 항상 싹싹 비워서 역시 기호성 갑이라는 생각이 듭니다."
5,"너무 잘먹고 있어요 근데 살이 너무 쪄서 다요트 사료로 갈아타야 할듯해요~ 몇년동안 먹여왔던 사료인데 같은 로얄껄로 바꿀려구여 계속 아마존에서 구매 잘하고 있습니다 저렴한 가격에
너무 잘먹고 있어요 근데 살이 너무 쪄서 다요트 사료로 갈아타야 할듯해요~ 몇년동안 먹여왔던 사료인데 같은 로얄껄로 바꿀려구여 계속 아마존에서 구매 잘하고 있습니다 저렴한 가격에 판매해 주셔서 너무나 감사드립니다^^"
5,"피부병때문에 병원 추천으로 구매해서 먹이고 있었는데 인터넷이 훨씬 저렴하네요 ㅎㅎ 먹이고나서 알러지도 많이 잡혔고 기호성도 좋아요. 다만 변이 딱딱해지는편이라서 급수량을 늘려야겠어
피부병때문에 병원 추천으로 구매해서 먹이고 있었는데 인터넷이 훨씬 저렴하네요 ㅎㅎ 먹이고나서 알러지도 많이 잡혔고 기호성도 좋아요. 다만 변이 딱딱해지는편이라서 급수량을 늘려야겠어요 ㅎ"
4,"배송도 빠르고 원인 모를 알러지 때문에 눈물이 엄청 많이 났었는데 이 사료 덕분에 눈물 자국 잡았습니다 :) 말티즈 친구들에게 딱 맞는 사료!!! 병원에서 판매하는 것보다 저렴해서
배송도 빠르고 원인 모를 알러지 때문에 눈물이 엄청 많이 났었는데 이 사료 덕분에 눈물 자국 잡았습니다 :) 말티즈 친구들에게 딱 맞는 사료!!! 병원에서 판매하는 것보다 저렴해서 더 좋아요 두 봉지째 구매합니다~~"
5,"18살 할무니인데 평생 사료 안먹던 얜데수치관리해야해서 사료를 먹이려구 샘플로 먹여보다가그나마 조금 먹길래 사봤어요근데 점점 잘먹네요 넘 다행이에요!! 또 구매할게요애기들껄 좋아하
18살 할무니인데 평생 사료 안먹던 얜데
수치관리해야해서 사료를 먹이려구 샘플로 먹여보다가
그나마 조금 먹길래 사봤어요
근데 점점 잘먹네요 넘 다행이에요!! 또 구매할게요
애기들껄 좋아하네요 할무이가"
5,"강아지가 습진이 잘 생겨 친구추천으로 먹이고있어요.효과는 아직 잘 모르겠으나 이번 여름에 확실히 알 수 있을듯 해요~기호성도 좋아요가격이 비싼겐 흠이지만..ㅜ
강아지가 습진이 잘 생겨 친구추천으로 먹이고있어요.
효과는 아직 잘 모르겠으나 이번 여름에 확실히 알 수 있을듯 해요~
기호성도 좋아요
가격이 비싼겐 흠이지만..ㅜ"
5,"항상 먹는 사료예요애들 한달에 한번씩 꼭 사는데 넘 잘 먹고 눈물도 없어지고 건강에도 좋은 것 같아요 탈도 안나고 좋네요 알갱이 작아서 소형견 먹기도 적당해요^^
항상 먹는 사료예요
애들 한달에 한번씩 꼭 사는데 넘 잘 먹고 눈물도 없어지고 건강에도 좋은 것 같아요 탈도 안나고 좋네요 알갱이 작아서 소형견 먹기도 적당해요^^"
5,"배송이 바로 와서 다행스럽게 먹였어요. 알레르기가 있어서 로얄캐닌어덜트푸들과 섞여서 먹이고 있습니다. 작은 알이라서 정말 잘 먹어요. 큰 알은 씹지를 못하고 힘들어 했거든요..
배송이 바로 와서 다행스럽게 먹였어요. 알레르기가 있어서 로얄캐닌어덜트푸들과 섞여서 먹이고 있습니다. 작은 알이라서 정말 잘 먹어요. 큰 알은 씹지를 못하고 힘들어 했거든요.."
5,"카레향이 기분좋게 풍기네요^^멍멍씨 밥 줄때마다 카레먹고 싶어져요.아예 안먹는건 아닌데ㅡ적응이 필요하네요.덥석먹지는 않고 나눠먹어요ㅡ귀알러지 있어서이제품으로 정착하고 싶은데ㅡ좀 잘
카레향이 기분좋게 풍기네요^^
멍멍씨 밥 줄때마다 카레먹고 싶어져요.
아예 안먹는건 아닌데ㅡ적응이 필요하네요.
덥석먹지는 않고 나눠먹어요ㅡ귀알러지 있어서
이제품으로 정착하고 싶은데ㅡ좀 잘 먹어줬으면ㅜㅜ"
5,"집의 멍이가 무척 까다로운 편인데, 이건 잘 먹어요. 알러지도 있었는데, 이 사료 먹고 없어졌습니다. 좀 비싸기는 하지만 병원에 다니면서 쓴 비용도 만만치 않아서 너무 만족합니다^
집의 멍이가 무척 까다로운 편인데, 이건 잘 먹어요. 알러지도 있었는데, 이 사료 먹고 없어졌습니다. 좀 비싸기는 하지만 병원에 다니면서 쓴 비용도 만만치 않아서 너무 만족합니다^^"
5,"처방식사료는 입도 안대던 아이인데 하이포는 주는대로 바로 먹어서 놀랐네요. 혈변과 설사때문에 시켰는데 물건받기전에 좋아져서 이왕 시킨거 일반사료와 섞어먹일예정입니다
처방식사료는 입도 안대던 아이인데 하이포는 주는대로 바로 먹어서 놀랐네요. 혈변과 설사때문에 시켰는데 물건받기전에 좋아져서 이왕 시킨거 일반사료와 섞어먹일예정입니다"
5,"항상 강쥐가 잘 먹는거라 매번 시키고 있습니다!기호성은 두말 할것 없고 피부가 약한 아인데 이거 먹으면 발진이나 다른 특이사항이 없어서 꾸준히 구매중이에요!
항상 강쥐가 잘 먹는거라 매번 시키고 있습니다!기호성은 두말 할것 없고 피부가 약한 아인데 이거 먹으면 발진이나 다른 특이사항이 없어서 꾸준히 구매중이에요!"
4,"만성 아토피때문에 항상 이 사료만 먹이는데 다른 사료보다 훨씬 살도 안찌고 맛도 좋은지 강아지도 잘 먹어요~~근데 스몰독 제품이 품절이 잘되서 여기도 종종 이용할 것 같습니당-!
만성 아토피때문에 항상 이 사료만 먹이는데 다른 사료보다 훨씬 살도 안찌고 맛도 좋은지 강아지도 잘 먹어요~~
근데 스몰독 제품이 품절이 잘되서 여기도 종종 이용할 것 같습니당-!"
5,"입이 짧아서 사료를 잘 안먹는데 이 제품은 정말 잘 먹어요 피부가 안좋아져서 주문했는데 역시 효과가 있습니다. 알맹이가 작아서 소형견이 씹기에도 좋구요. 배변 냄새도 많이 안나서
입이 짧아서 사료를 잘 안먹는데 이 제품은 정말 잘 먹어요 피부가 안좋아져서 주문했는데 역시 효과가 있습니다. 알맹이가 작아서 소형견이 씹기에도 좋구요. 배변 냄새도 많이 안나서 좋네요 또 주문할게요^^"
4,"알러지가 있어서 이 사료만 먹이는데 모든 사이트가 다 품절이라.. 여기는 가은 비싸지만 배송비가 저렴해서 주문했네요. 일단 잘 받았습니다. 그런데 왜 이 상품만 모두 품절인지 이해
알러지가 있어서 이 사료만 먹이는데 모든 사이트가 다 품절이라.. 여기는 가은 비싸지만 배송비가 저렴해서 주문했네요. 일단 잘 받았습니다. 그런데 왜 이 상품만 모두 품절인지 이해가 안가네요"
4,"아이가 피부가 안 좋아서 지인 추천으로 구입했는데 원래 비린내 나는 걸 싫어하는 녀석이라 짐작은 했지만 내밀자 마자 외면하네요 그래도 피부 좋아지라고 억지로
아이가 피부가 안 좋아서 지인 추천으로 구입했는데 원래 비린내 나는 걸 싫어하는 녀석이라 짐작은 했지만 내밀자 마자 외면하네요 그래도 피부 좋아지라고 억지로 수저로 먹였어요ㅋ"
5,"노견 키우는 중인데 면역력 부족인지 입 주변 알러지가 일어나기 시작해서 이 사료로 바꿨어요. 조금은 도움이 되는 것 같아 좋네요. 강아지 기호성도 좋습니다.
노견 키우는 중인데 면역력 부족인지 입 주변 알러지가 일어나기 시작해서 이 사료로 바꿨어요. 조금은 도움이 되는 것 같아 좋네요. 강아지 기호성도 좋습니다."
5,"우리댕댕이두마리 둘다잘먹어요 한놈귀가좀안좋아어먹기시작했는데 귀는다낫지만그냥 이거먹여요 단백질인가 가수분해되어서 좋다고하는데 구체적으론모르지만 애들다건강하긴해요
우리댕댕이두마리 둘다잘먹어요 한놈귀가좀안좋아어먹기시작했는데 귀는다낫지만그냥 이거먹여요 단백질인가 가수분해되어서 좋다고하는데 구체적으론모르지만 애들다건강하긴해요"
5,"매번 강아지 피부때문에 걱정이 많고, 병원비도 만만치 않았는데, 역시 그것보다는 강아지가 얼마나 괴로울까 징작이 안되더라구요. 작작년 이맘때부터 먹이고 있는데 지금은 피부 완
매번 강아지 피부때문에 걱정이 많고, 병원비도 만만치 않았는데, 역시 그것보다는 강아지가 얼마나 괴로울까 징작이 안되더라구요. 작작년 이맘때부터 먹이고 있는데 지금은 피부 완전 좋아요. 안심하고 먹입니다 ^^"
5,"알러지때문에 계속 귓병이나서 병원에서 추천해줘서 먹이다가 여기가 저렴해서 구매했어요 유통기한도 21년 3월까지ㅎ 만든지 4~5개월 정도 지난거긴 하지만 다른 곳에 비해 유통기한이
알러지때문에 계속 귓병이나서 병원에서 추천해줘서 먹이다가 여기가 저렴해서 구매했어요 유통기한도 21년 3월까지ㅎ 만든지 4~5개월 정도 지난거긴 하지만 다른 곳에 비해 유통기한이 길어서 좋습니다^^"
2,"선물을 했는데 물건이 잘 못 도착했더라구요.다른 상품보낸지 알고 이미 봉지를 뜯어서 교환은 못하네요;;장에 좋은 사료였어요...다음번에는 잘 좀 부탁드려요
선물을 했는데 물건이 잘 못 도착했더라구요.
다른 상품보낸지 알고 이미 봉지를 뜯어서 교환은 못하네요;;
장에 좋은 사료였어요...
다음번에는 잘 좀 부탁드려요"
5,"5개월아이가 피부트러블이 있어서 구매해봤는데 일단 잘먹긴해요 근데 피부는 별반 달라지지 않는걸 보니 다른이유인듯해서 병원갔다왔는데 당최 별이상이 없다네요 ㅜ 더먹여봐야겠어요
5개월아이가 피부트러블이 있어서 구매해봤는데 일단 잘먹긴해요 근데 피부는 별반 달라지지 않는걸 보니 다른이유인듯해서 병원갔다왔는데 당최 별이상이 없다네요 ㅜ 더먹여봐야겠어요"
5,"우리애가 ibd 가진단을 받고 처방받아서 먹고있는 사료에요~밥먹는 시간만되면 밥달라고 난리일정도 ㅋㅋ 엄청 잘먹습니다!유통기한도 넉넉하네요! 감사해요^^
우리애가 ibd 가진단을 받고 처방받아서 먹고있는 사료에요~
밥먹는 시간만되면 밥달라고 난리일정도 ㅋㅋ 엄청 잘먹습니다!
유통기한도 넉넉하네요! 감사해요^^"
5,"너무 잘먹어서 큰일이에요ㅜ 병원에서 추천해주셨는데 발핥는거랑 귀긁는게 싹 없어졌어요! 피부에도 좋은데 맛까지있으니 가격대있어도 계속 재구매합니다.
너무 잘먹어서 큰일이에요ㅜ 병원에서 추천해주셨는데 발핥는거랑 귀긁는게 싹 없어졌어요! 피부에도 좋은데 맛까지있으니 가격대있어도 계속 재구매합니다."
4,"동물병원에서 추천받아서 먹이고 있어요 기호성도 좋고 유통기한도 넉넉해요 저희 강아지가 워낙 입이 짧아서 사료를 잘 먹지 않는데 이건 그래도 제법 먹네요 알갱이도 작아서 소형견이 먹
동물병원에서 추천받아서 먹이고 있어요 기호성도 좋고 유통기한도 넉넉해요 저희 강아지가 워낙 입이 짧아서 사료를 잘 먹지 않는데 이건 그래도 제법 먹네요 알갱이도 작아서 소형견이 먹기에 적당해요"
5,"식이 알러지가 있어 위장이 약한 아가이다보니 하이포알러제닉으로 사료를 아예 변경하게됐어요! 생각보다 처음에 금액이 비싼가라고 생각했는데 정말 좋은 가격에 잘 구매했습니다! 앞으로도
식이 알러지가 있어 위장이 약한 아가이다보니 하이포알러제닉으로 사료를 아예 변경하게됐어요! 생각보다 처음에 금액이 비싼가라고 생각했는데 정말 좋은 가격에 잘 구매했습니다!
앞으로도 많이 구매할려구요!"
