rate,review
5,"몇년째 먹이고 있는 제품이에요. 강아지가 대장에 난치병이 있어서 평생 저알러지 가수분해단백질사료만 먹여야 하거든요.이것저것 먹여봤는데 이거를 제일 잘 먹기도하고, 대변상태도 제일좋
몇년째 먹이고 있는 제품이에요. 강아지가 대장에 난치병이 있어서 평생 저알러지 가수분해단백질사료만 먹여야 하거든요.
이것저것 먹여봤는데 이거를 제일 잘 먹기도하고, 대변상태도 제일좋아서 다른걸로 바꿀수가없네요.
심지어 다른 회사 저알러지사료 먹였을때 정기검진에서 병이 상당히 악화됐었어요ㅜㅜ 그러고 급하게 다시 로얄캐닌으로 돌아왔는데 먹이고 한달만에 피검사 수치가 좋아졌구요.
로얄캐닌 아니면 저희집 강아지 죽어요진짜ㅠㅠ
저알러지사료 먹여야하는 견주분들 무조건 로얄캐닌으로 먹이세요.
로얄캐닌 관계자 절대 아닙니다요ㅜㅜ
저희집 강아지 아직 4살밖에 안돼서 로얄캐닌먹고 오래살아야해요ㅜㅜ 로얄캐닌 이대로 쭉 영원히 함께해주세요♡♡"
5,"요즘 좋은가격 구하기도 쉽지않은데.. 배송비도 맘에 들고.. 유통기한도 아주 넉넉하고.. 너무너무 만족합니다.. 많이많이 파세요~~1kg 한봉지는 20일정도 먹는거라.. 늘
요즘 좋은가격 구하기도 쉽지않은데..
배송비도 맘에 들고.. 유통기한도 아주 넉넉하고.. 너무너무 만족합니다.. 많이많이 파세요~~
1kg 한봉지는 20일정도 먹는거라.. 늘 미리미리 구하는 편이예요
이번달 월급 받으면 한번 더 구매해서 쟁여두려고요~~~"
5,"갑자기 강아지가 피부질환이 생겨서 시켜봤어요 잘 안먹으면 어쩌나 했는데..왠걸...너무 잘먹어요 사람이 냄새맡아봐도 눅진내?안나고 고소한 냄새난다했더니 저희 집 강아지 진짜 환장하
갑자기 강아지가 피부질환이 생겨서 시켜봤어요 잘 안먹으면 어쩌나 했는데..왠걸...너무 잘먹어요 사람이 냄새맡아봐도 눅진내?안나고 고소한 냄새난다했더니 저희 집 강아지 진짜 환장하고 먹어요ㅋㅋ 밥으로 주려고했는데 저렇게 와구와구 먹다간 뚱땡이 될까봐 정량보다 줄여서 간식으로 주려고요ㅋㅋ 피부질환땜에 간식 다 끊고 사료랑 양배추만 먹었거든요 먹으려면 아직 하아안참 남았지만 다 먹으면 다시 주문할께요 😆"
5,"22년 5월 4일까지네요 오랜만에 찐 개사료냄새를 맡았어요ㅎㅎ 푸들인데 알러지반응 넘 심하고 왜때문인지는 모르겠고 귀랑 눈이랑 너무 붓고 총체적 난국이라 병원에서 추천해줬어요간식을
22년 5월 4일까지네요 오랜만에 찐 개사료냄새를 맡았어요ㅎㅎ 푸들인데 알러지반응 넘 심하고 왜때문인지는 모르겠고 귀랑 눈이랑 너무 붓고 총체적 난국이라 병원에서 추천해줬어요
간식을 다 끊기도했고 기호성이 좋은 사료라 그런지 다행히 잘 먹네요 하지만 씹질 않아요 ㅜㅜ 그래도 온라인가격 조금이라도 싸서 다행이에욤"
5,"강아지의 피부가 예민해서 동물병원에서 이 사료를 권해주셨어요. 확실히 바꾼 후 피부에 뭐가 나거나 간지러움이 덜 해져서 만족합니다.입이 짧은 편인데도 아주 잘 먹어요! 그리고 무엇
강아지의 피부가 예민해서 동물병원에서 이 사료를 권해주셨어요. 확실히 바꾼 후 피부에 뭐가 나거나 간지러움이 덜 해져서 만족합니다.입이 짧은 편인데도 아주 잘 먹어요! 그리고 무엇보다 오전에 입금해서 당일 배송으로 다음날 잘 받았습니다."
5,"가격도 동물병원보다 저렴하고사료 떨어지면 큰일나니까항상 넉넉히 사두고 있어요!!! 😀너무 사료만 주기 미안해서 맛있는거 가끔 만들어 준답니다~~~그럼 또 잘 먹어요 ☺️털이 빠져
가격도 동물병원보다 저렴하고
사료 떨어지면 큰일나니까
항상 넉넉히 사두고 있어요!!! 😀
너무 사료만 주기 미안해서
맛있는거 가끔 만들어 준답니다~~~
그럼 또 잘 먹어요 ☺️
털이 빠져서 피부가 안 좋았었는데
이거 몇 번 먹고 좋아졌어요!
근데도 불안해서 계속 먹이고 있어요!
잘 먹어요!!🙌"
5,"입이 짧아서 잘 안먹는 스타일이예요.결석과 피부트러블로 이 사료 먹은지 벌써 십년이 된것 같아요.잘 먹으며, 피부 완전 좋아졌어요.이 사료 먹고서는 피부때문에 병원 간적이 없네요.
입이 짧아서 잘 안먹는 스타일이예요.
결석과 피부트러블로 이 사료 먹은지 벌써 십년이 된것 같아요.
잘 먹으며, 피부 완전 좋아졌어요.
이 사료 먹고서는 피부때문에 병원 간적이 없네요.
피부트러블로 고생한다면 강추해요~
사료통에 조금씩 덜어놓고 주면 냄새가 오래가서 더 잘 먹더라구요.."
5,"병원서 닭 사과 알러지반응이 있어서 사료로 고민한다니까 여러 종류들 주셨는데 그중 샘플로 먹은 것들 중 제일 잘먹어서 선택했어요. 1년지나니까 입이 짧아져서 사료를 잘 안 먹더라구
병원서 닭 사과 알러지반응이 있어서 사료로 고민한다니까 여러 종류들 주셨는데 그중 샘플로 먹은 것들 중 제일 잘먹어서 선택했어요. 1년지나니까 입이 짧아져서 사료를 잘 안 먹더라구요. 살면서 큰 문제 있는건 아니니 한 끼 먹더라도 잘 먹는거 주고싶어서 선택했어요. 오래오래 맛잇게 먹어줬으먄 좋겠아요!"
5,"배송 빠르고 포장도 꼼꼼합니다. 유통기한 왼전 넉넉하고요. 우리아이기 포장지를 찌그러트려서 쭈글거리는듯 보이지만 엄청깔끔한제품 꼼꼼히포장해주셨어요^^강아지건강에 대한 정보도 알려주
배송 빠르고 포장도 꼼꼼합니다. 유통기한 왼전 넉넉하고요. 우리아이기 포장지를 찌그러트려서 쭈글거리는듯 보이지만 엄청깔끔한제품 꼼꼼히포장해주셨어요^^
강아지건강에 대한 정보도 알려주시고! 세심하시더라고요. 또주문할게요^^"
5,"가격은 좀 비싸지만, 피부병이 잦은 강쥐에게는 이 사료 완전 추천합니다! 우리강쥐도 12살에 단백질성을 많이 먹으면 온몸이 가려워 긁고 상처입고 했었는데, 사료를 이걸로 바꾸고 난
가격은 좀 비싸지만, 피부병이 잦은 강쥐에게는 이 사료 완전 추천합니다! 우리강쥐도 12살에 단백질성을 많이 먹으면 온몸이 가려워 긁고 상처입고 했었는데, 사료를 이걸로 바꾸고 난후부터는 피부가 연핑크색으로 아주 깨끗해요^^"
5,"우리강아쥐
기본 10자 이상 작성시 100P 즉시지급 이미지 등록시 100P 즉시 추가지급개당 상품 가격이 5,000원 이하 상품은 적립대상에서 제외되며,리뷰 포인트는 최초 1회 작성시에만 지급됩니다.같은 단어가 반복된 내용은 임의로 삭제되며, 지급된 포인트가 회수될 수 있습니다. 다른 고객님들에게 유용한 상품 리뷰를 작성해주세요.우리강아지는 로얄캐닌 사료만 아주 잘먹습니다"
5,"알러지때문에 매번 고생하는 우리아가 샘플사료를 먹여본 후 직접 구매해서 주고있는데 강아지들이 아주 좋아할 냄새 ㅋㅋ의 사료 하지만 변에서는 냄새가 나진 않아요 아주 잘먹어요 피부가
알러지때문에 매번 고생하는 우리아가
샘플사료를 먹여본 후
직접 구매해서 주고있는데
강아지들이 아주 좋아할 냄새 ㅋㅋ의 사료
하지만 변에서는 냄새가 나진 않아요
아주 잘먹어요
피부가 안좋은 친구들이 먹기에
많은 도움이 되실겁니다"
5,"아가들 피부가 안좋아져서 꾸준하게 먹이고 있는데요즘 이 사료가 금사료인지 구하기가 너무 힘드네요ㅠㅠ스몰독이라 알맹이가 작아요.저는 알러제닉도 삿는데 비교해보시라고 알맹이샷 올려요!
아가들 피부가 안좋아져서 꾸준하게 먹이고 있는데
요즘 이 사료가 금사료인지 구하기가 너무 힘드네요ㅠㅠ
스몰독이라 알맹이가 작아요.
저는 알러제닉도 삿는데 비교해보시라고 알맹이샷 올려요!
두제품 모두 기호성 좋아서 올 겨울은 든든합니다!"
5,"어릴때부터 16살이된 지금까지 꾸준히 먹이고있는 제품이에요~ 닭고기 알러지가 있고, 심장병약도 먹는중이라.. 어릴때부터 워낙 입이 짧아서 꾸준히 먹일수 있는 사료가 많지 않은데..
어릴때부터 16살이된 지금까지 꾸준히 먹이고있는 제품이에요~ 닭고기 알러지가 있고, 심장병약도 먹는중이라.. 어릴때부터 워낙 입이 짧아서 꾸준히 먹일수 있는 사료가 많지 않은데.. 이제품은 정말 잘먹어서 항상 주문해서 먹이고 있어요~~ 항상 여기서만 주문해야겠어요~ 유통기한도 넉넉하고 배송도 빨라서 좋아요~~"
5,"원래 먹던 사료가 있었는데 피부병이 약먹으면 낫다가 약 끊으면 계속 재발을 해서 동물병원에서 추천해준 이 사료와 간식 끊고 다시 재발하지 않고 있어요, 약 끊은지 1달 넘었는데 피
원래 먹던 사료가 있었는데 피부병이 약먹으면 낫다가 약 끊으면 계속 재발을 해서 동물병원에서 추천해준 이 사료와 간식 끊고 다시 재발하지 않고 있어요, 약 끊은지 1달 넘었는데 피부병이 재발하지 않아서 앞으로 쭉 이 사료만 먹이려구요
오돌도돌하게 올라오고 매일 긁는게 심했는데 지금은 긁지도 않고 오돌도돌한것도 다 나았어요~강추해요"
5,"강아지가 언젠가부터 눈물을 많이 흘리고 그러면서 냄새도 심하고 눈물자국이 빨갛게 변했었어여 ㅠ 그런데 그게 얼러지 때문이란걸 알고 이 사료로 바꾸었는데 바꾸고나서는 눈주변도 깨끗
강아지가 언젠가부터 눈물을 많이 흘리고 그러면서 냄새도 심하고 눈물자국이 빨갛게 변했었어여 ㅠ 그런데 그게 얼러지 때문이란걸 알고 이 사료로 바꾸었는데 바꾸고나서는 눈주변도 깨끗하고 눈물도 거의 안흘려서 냄새도 안나요~~ 먹기도 잘먹습니다"
5,"식이알러지때문에 주문했어요 두마리라서 사료값이 만만치 않네요 그래도 이사료 먹은지 1년정도 되었는데알러지90프로 이상 완치 되어서 이것만 먹어여할것같아요 ㅠㅠ중간에 다른걸로 바꿨
식이알러지때문에 주문했어요
두마리라서 사료값이 만만치 않네요
그래도 이사료 먹은지 1년정도 되었는데
알러지90프로 이상 완치 되어서
이것만 먹어여할것같아요 ㅠㅠ
중간에 다른걸로 바꿨는데 바로올라와서
선택이 없네요 !수고하세용"
5,"키우는 말티즈가 단백질 알러지가 있어서 사료에 신경을 많이 쓰는데 알러지 사료들 중 제일 염증이 안 올라와요.덜 간지러워 하는게 눈에 띠게 보이니 이제 다른 종류는 안먹이고 로얄캐
키우는 말티즈가 단백질 알러지가 있어서 사료에 신경을 많이 쓰는데 알러지 사료들 중 제일 염증이 안 올라와요.덜 간지러워 하는게 눈에 띠게 보이니 이제 다른 종류는 안먹이고 로얄캐닌 하이포 알러제닉 스몰브리드만 먹여야겠다 싶어요"
5,"감사합니당!!아이들이 너무 잘 먹어요!알러지 때문에 간식을 못 주가 보니 밥 은 좋은거 먹이고 싶어서 수제밥 5년 동안 먹이다가 이번에 의사샘 추천으로 하이퍼 알러지로 바꿨는데 수
감사합니당!!
아이들이 너무 잘 먹어요!
알러지 때문에 간식을 못 주가 보니 밥 은 좋은거 먹이고 싶어서 수제밥 5년 동안 먹이다가 이번에 의사샘 추천으로 하이퍼 알러지로 바꿨는데 수제라고 다 좋은 건 아닌가봐요ㅠ 하니퍼알러지먹고 피부 진짜 많이 좋아졌어요 짱 신기해요"
5,"알러지가 나타나길래 고민하다가 이걸로 결정했는데 사료를 너무 잘먹어요! 원래 저희 아이가 사료 정말 안좋아하거든요(자동으로 자율급식할정도로) 제한급식 도전해보려합니다. 알러지가 사
알러지가 나타나길래 고민하다가 이걸로 결정했는데 사료를 너무 잘먹어요! 원래 저희 아이가 사료 정말 안좋아하거든요(자동으로 자율급식할정도로) 제한급식 도전해보려합니다. 알러지가 사라져도 다시 사먹이러 올게요!! 기호성 굿굿!!!"
3,"아직 먹여본지 얼마 안돼서 확실한 효과는 모르겠어요.!일단 가격은 역시 너무 비싸고 안긁기만하면 괜찮은데 더 먹여봐야할거같아요. 문제는 묽은똥을 싸거나 배변을 잘 보지를 않아서 걱
아직 먹여본지 얼마 안돼서 확실한 효과는 모르겠어요.!
일단 가격은 역시 너무 비싸고 안긁기만하면 괜찮은데 더 먹여봐야할거같아요. 문제는 묽은똥을 싸거나 배변을 잘 보지를 않아서 걱정입니다...원래 이 사료가 이런건지 갑자기 사료를 바꿔서 그런건지 모르겠어요."
5,"평소 눈물 알러지도 심한편이고 최근에는 결석수술까지 했는데, 병원에서 로얄캐닌 처방사료를 권해주셔서 처음 주문해보았습니다. 잘 먹어주길 기대해봅니다. 유효기간 아주 넉넉하고 배송도
평소 눈물 알러지도 심한편이고 최근에는 결석수술까지 했는데, 병원에서 로얄캐닌 처방사료를 권해주셔서 처음 주문해보았습니다. 잘 먹어주길 기대해봅니다. 유효기간 아주 넉넉하고 배송도 하루만에 빨리 왔습니다. 만족합니다."
5,"우리 아이 7년정도 꾸준히 먹고 있는 제품입니다.입이 짧아 사료교체하기 너무 힘든데 같은 로얄케닌에서 라인만 다른 이제품으로는 쉽게 바꿀수있었어요.문제는 다른 처방식으로 잠시라도
우리 아이 7년정도 꾸준히 먹고 있는 제품입니다.입이 짧아 사료교체하기 너무 힘든데 같은 로얄케닌에서 라인만 다른 이제품으로는 쉽게 바꿀수있었어요.문제는 다른 처방식으로 잠시라도 교체해야할땐 전혀 먹지않아요…"
5,"입 짧은 우리집 댕댕이그 동안 정말 많은 사료를 골고루 먹여봤는데잘 안 먹어서 엄청 힘들었어요미니비숑이 눈물땜에 사료 알아보던중후기 좋아서 구매했어요타 사이트보다 가격도 저렴하고배
입 짧은 우리집 댕댕이
그 동안 정말 많은 사료를 골고루 먹여봤는데
잘 안 먹어서 엄청 힘들었어요
미니비숑이 눈물땜에 사료 알아보던중
후기 좋아서 구매했어요
타 사이트보다 가격도 저렴하고
배송은 로켓배송이네요
오늘 처음으로 사료 맛있게 먹는 모습보고
제가 다 뿌듯 ㅎㅎ
앞으로 쭉 이것만 먹일거 같아요
아울러 알러지눈물에도 효과가 있었으면
좋겠어요😍"
5,"최고예요
상품 너무 깨끗하게 잘 왔고요. 유통기한도 길고 넘 잘 샀어요. 뭔가 두둑한 게 한동안 잘 먹일 수 있을 거 같아요~ 같이 주신 간식도 잘 먹일게요~ 어제인지 그저께인지 받았는데 먼저 먹이던 것 다 먹고 오늘에서야 언박싱을ㅋㅋ 여튼 받아보고 여러가지로 만족해서 길게 남겼어요~ 감사합니다~"
4,"항상 제일 저렴하게 유효기간 넉넉한 상품 받아 쓰고 있어요이번에 추석이 있어서 어쩔 수 없이 근처에 가서 사서 쓰는 바람에 2개가 되었어요그래서 봉투를 뜯어보진 못 했지만늘 주문하
항상 제일 저렴하게 유효기간 넉넉한 상품 받아 쓰고 있어요
이번에 추석이 있어서 어쩔 수 없이 근처에 가서 사서 쓰는 바람에 2개가 되었어요
그래서 봉투를 뜯어보진 못 했지만
늘 주문하던 곳이라 믿음이 있어요
많이 파셔요~~^^"
5,"두번째 구매네요~생각지도 못하고 있다가 애기 밥이 떨어져서는급하게 주문했는데 바로배송 해주셔서 안굶겼네요 ^^;;귀에 알러지가 있는아아라 항상 요것만먹는데 크기도 적당하고 맛도 있
두번째 구매네요~
생각지도 못하고 있다가 애기 밥이 떨어져서는
급하게 주문했는데 바로배송 해주셔서
안굶겼네요 ^^;;
귀에 알러지가 있는아아라 항상 요것만
먹는데 크기도 적당하고 ~
ㅎ"
5,"하이포알러지제품은기존에 먹던 상품이라, 믿고 사는 제품 입니다.작년에 입양한 유기견 초롱이가 피부질환이 너무 심해요 입도 짧고, 사료도 잘 먹지 않는데, 알이 작아서, 시츄 아이도
하이포알러지제품은기존에 먹던 상품이라, 믿고 사는 제품 입니다.
작년에 입양한 유기견 초롱이가 피부질환이 너무 심해요 입도 짧고, 사료도 잘 먹지 않는데, 알이 작아서, 시츄 아이도 먹기 좋구요
하이포알러지 2키로 산거는 알이 커서 실패했네요 ㅠㅠ"
5,"애들이 관절이 약하고,,,입주변 가려움증 등 알레르기가 있는데..병원에서 추천받아,,,계속 먹이고 있는 사료입니다.이 싸이트에서 좀더 저렴하게 살수 있어서 좋아요.사료의 질,,착한
애들이 관절이 약하고,,,입주변 가려움증 등 알레르기가 있는데..
병원에서 추천받아,,,계속 먹이고 있는 사료입니다.
이 싸이트에서 좀더 저렴하게 살수 있어서 좋아요.
사료의 질,,착한 금액, 유통기한 하자 없이 계속 유지되었으면 하는 바램입니다."
5,"입맛까다로워 잘안먹는 울강아지...안먹을까봐 걱저이 앞섰지만...생각보다 너무잘먹고..오자마자 먹는걸 보니...사료값을열심히 벌어야겟다는생각이드네욬ㅋㅋ기름기가 많아 시킬까걱정햇지만
입맛까다로워 잘안먹는 울강아지...안먹을까봐 걱저이 앞섰지만...생각보다 너무잘먹고..오자마자 먹는걸 보니...사료값을열심히 벌어야겟다는생각이드네욬ㅋㅋ기름기가 많아 시킬까걱정햇지만..생각보다 기름기가 없어요 눈물도 줄어드는거같고 꾸준히 먹일게요!!"
5,"세 녀석을 키우는데 피부에 까만 점 같은 것이 생겨서 병원에 갔더니 처방사료를 먹이라고 해서 바꾸었는데 잘 먹네요 근데 가격이 너무 비싸요 이곳 저곳 열심히 뒤지다가 제일 저렴해서
세 녀석을 키우는데 피부에 까만 점 같은 것이 생겨서 병원에 갔더니 처방사료를 먹이라고 해서 바꾸었는데 잘 먹네요 근데 가격이 너무 비싸요 이곳 저곳 열심히 뒤지다가 제일 저렴해서 구매 했는데
기존 먹이던 사료(건강백서)의 가격에 3배는 되네요 ㅠㅠ"
5,"이놈의 이쁜놈은... 피부가 안좋아서 먹는건데... 무슨 꿀발라놓은 사료먹나.... 뭐이리 먹어대는지.... 나도 먹어보고 싶어지게.... 일단 우리 이쁜놈은 잘 먹네유~ 피부가
이놈의 이쁜놈은... 피부가 안좋아서 먹는건데... 무슨 꿀발라놓은 사료먹나.... 뭐이리 먹어대는지.... 나도 먹어보고 싶어지게.... 일단 우리 이쁜놈은 잘 먹네유~ 피부가 이 사료때문인진 모르겠는데(약도 겁나 먹이고 약용샴푸꺼정 쓰고있으니....내돈...ㅠㅠ) 나아지는 것 같기도 하고~~~~ 하아.... 내가 사료회사 차리고 싶다.... 돈이 얼마야 ㅠㅠ 하아"
5,"믿고사는 펫비앙:)재고부족이라 수급하시는것도 어려우실텐데늘 우리강아지 애견인들을 위해 사료공급해주시고 너무감사드려요ㅠㅠ펫비앙 이용한 횟수가 어느덧 10회가량이 되어가네요 늘 변함없
믿고사는 펫비앙:)
재고부족이라 수급하시는것도 어려우실텐데
늘 우리강아지 애견인들을 위해 사료공급해주시고 너무감사드려요ㅠㅠ
펫비앙 이용한 횟수가 어느덧 10회가량이 되어가네요 늘 변함없는 응대와 서비스 감사드려요~~^^"
5,"항상 병원에서 구매하다가 구매하는 병원이문닫는 상황이되서 인터넷으로 주문했는데괜찮네요ㅎ그리고 이곳이 제일 저렴했어요^---^소비자입장에서는 최고!다시 주문하려고 들어왔지ㅜㅜㅜ구매
항상 병원에서 구매하다가 구매하는 병원이
문닫는 상황이되서 인터넷으로 주문했는데
괜찮네요ㅎ
그리고 이곳이 제일 저렴했어요^---^
소비자입장에서는 최고!
다시 주문하려고 들어왔지ㅜㅜㅜ
구매가.. 안되네요
아쉬워서 한달후기 남기고갑니다ㅜ"
1,"최악이에요
찾던 제품이라 주문했는데, 물량이 부족하다고 출고 날짜가 지연되고, 언제 발송 될지 궁금하여 전화했는데 3.5키로 짜리가 언제 입고 될지 모르니 1키로 짜리 3개 랑 나머지 500g은 샘플로 용량 맞추어 보내줄 수 있다는게 말이 되는 말인가요.. 소비자가 좋아할까요? 아무튼 다신 여기서 구매할 의사 없습니다."
5,"정말이리잘먹는사료가 없어요.더군다나 눈물자국..효과있습니다. 여러가지사료 먹여봤는데 눈물개선 효과없었어요. 예전에 어디선가 로얄캐닌 살찐다는 소리를들어 안사먹였었는데 혹시나 사봤더
정말이리잘먹는사료가 없어요.더군다나 눈물자국..효과있습니다. 여러가지사료 먹여봤는데 눈물개선 효과없었어요. 예전에 어디선가 로얄캐닌 살찐다는 소리를들어 안사먹였었는데 혹시나 사봤더니 . ..먹인지 한달됐는데. 꽤많이 옅어졌습니다.앞으로쭉 로얄캐닌으로~~"
5,"울 댕댕이 제일 좋은 동결건조 사료 먹이다가 눈물자국이 심하고 귀를 긁어서 수의사쌤한테 추천받아 첫 주문해요 아무리 고급 사료도 댕댕이 한테 안 맞으면 좋다고 할수 없겠죠이 사료
울 댕댕이 제일 좋은 동결건조 사료 먹이다가 눈물자국이 심하고 귀를 긁어서 수의사쌤한테 추천받아 첫 주문해요
아무리 고급 사료도 댕댕이 한테 안 맞으면 좋다고 할수 없겠죠
이 사료 먹이고 알러지가 없어지면 평생 먹일 생각입니다"
3,"아니 무른 사료를 봉투에 덜렁보냅니까? 저렴한사료도아니고 내가 10녀넘게 사료를 구매해봤지만 덜렁 봉투에 보내는건 첨보내요... 여기서만 세번째주문이데 전에 주문했을때 박스에보내주
아니 무른 사료를 봉투에 덜렁보냅니까? 저렴한사료도아니고 내가 10녀넘게 사료를 구매해봤지만 덜렁 봉투에 보내는건 첨보내요... 여기서만 세번째주문이데 전에 주문했을때 박스에보내주더니 사료알갱이가 부서지면 어쩔려고 봉투에보내나요? 이가격에 사은품하나없는것도 섭한데 포장이 봉투라니..."
5,"병원에서 22000원주고 구입했어요단모종이라 각질이심했는데 하이포알러지3년째먹이는중인데 지금은 말끔해요원래단모종이 각질이심하게 일어나요 미니핀과 치와와 키우고있어요 이제는 이사료
병원에서 22000원주고 구입했어요
단모종이라 각질이심했는데 하이포알러지
3년째먹이는중인데 지금은 말끔해요원래단모종이 각질이심하게 일어나요 미니핀과 치와와 키우고있어요 이제는 이사료밖에안먹어요 배송도빠르고 저렴하게 구입했습니다^^
구매의사100%입니다"
5,"이 제품만 지금 몇번째 재구매해서 먹고 있어요!애기들도 맛있어서 너무 잘먹고...너무 잘먹어서 큰일이에요 ㅎㅎ피부가 안좋아서 병원에서 추천해줘서 먹었는데피부에 도움이 되는지는 크게
이 제품만 지금 몇번째 재구매해서 먹고 있어요!
애기들도 맛있어서 너무 잘먹고...
너무 잘먹어서 큰일이에요 ㅎㅎ
피부가 안좋아서 병원에서 추천해줘서 먹었는데
피부에 도움이 되는지는 크게 잘 모르겟어요ㅜ
그치만 다른 제품보다는 믿음이 가서
계속 먹고 있어요 ♥"
4,"잘 안먹길래 먼저 먹던것과 섞어서 줘봤는데 좀 더 있어봐야겠어요
원래 계속 먹어오던 사료가 있지만 우리 강아지가 하도 눈물을 많이 흘려 눈물 자국이 생기길래 눈물이 안 나온다는, 적어도 훨씬 덜 나온다는 개사료를 사봤습니다. 잘 안먹길래 먼저 먹던것과 섞어서 줘봤는데 좀 더 있어봐야 효과가 있는지 없는지 알 수 있을것 같습니다."
5,"로얄캐닌 제품만 먹는데 피부 알러지가 좀있어서 알러지에 도움된다해서 이번에 피부사료로 바꿧는데 잘먹네요. 로얄캐닌이 기호성이 좋다구 하긴하드라구요. 이것먹고 피부트러블 줄었으면 하
로얄캐닌 제품만 먹는데 피부 알러지가 좀있어서 알러지에 도움된다해서 이번에 피부사료로 바꿧는데 잘먹네요. 로얄캐닌이 기호성이 좋다구 하긴하드라구요. 이것먹고 피부트러블 줄었으면 하는 엄마의 마음으로 구입햇어요. 번창하세요."
