rate,review
5,"다른거랑 섞여 먹이고 있어서 유통기한 긴걸로 보내달라고 톡톡드렸는데 읽고 답장이 없으시더니 유통기한 긴걸로 보내주셨어요. 무엇보다 이 사료가 수급이 어려워서 구하기 힘들다고 타 사
다른거랑 섞여 먹이고 있어서 유통기한 긴걸로 보내달라고 톡톡드렸는데 읽고 답장이 없으시더니 유통기한 긴걸로 보내주셨어요. 무엇보다 이 사료가 수급이 어려워서 구하기 힘들다고 타 사이트에서 답변을 받았는데 정말 그런가봐요. 원하는 키로수로 판매하는곳 찾기 어려웠어요. 똑같은 키로수라도 판매처에 따라서 가격차이가 많이 나던데 여기 쇼핑몰은 양심적으로 판매 하시길래 믿고 구매했습니다. 처방 사료라서 강아지가 맛없어 하는것 같아서 매번 소고기랑 삶아서 줬는데 그냥 사료만 줘도 매우 잘 먹어요. 지금은 또 품절인데 미리미리 사놔야 할듯 해요. 많이 파세요."
5,"🌼식이알러지, 아토피 케어하고 있는 아인데 병원에서 꼭 처방사료를 권하더라구요. 대체단백질원을 넣은 사료보다 가수분해된 게 좋다구요. 🌼사료 기호성도 아주 좋구요. 7kg 아이
🌼식이알러지, 아토피 케어하고 있는 아인데 병원에서 꼭 처방사료를 권하더라구요. 대체단백질원을 넣은 사료보다 가수분해된 게 좋다구요.

🌼사료 기호성도 아주 좋구요. 7kg 아이 기준 한 포대 딱 한 달 먹네요.
원래 싫증을 자주 내서 평소엔 사료를 자주 바꿔줬었는데 처방사료지만 아주 잘 먹어요. 요즘 들어 봄 타는지 식욕 너무 폭발이라..😂🐶🥰

🌼 알러지 아주 심한 편은 아니지만 예방 차원에서 하이포알러제닉 먹이는데 긁는 증상 등은 많이 줄은 것 같아요.

🌼펫비앙 제일 저렴해서 좋아요ㅠㅠ
오늘 여기서 네 통째 새로 주문했습니다.
오래오래 팔아주세요~~!!💖"
1,"사업장에서 사료를 잘못 보내셨는데 잘못 보낸 사료도 괜찮은 사료라고 급여 해보길 권유 하시길래 그냥 원래 먹이던 사료 먹이겠다며 거절하니 자꾸 사람 무안하게 자꾸 그냥 급여 해보면
사업장에서 사료를 잘못 보내셨는데 잘못 보낸 사료도 괜찮은 사료라고 급여 해보길 권유 하시길래 그냥 원래 먹이던 사료 먹이겠다며 거절하니 자꾸 사람 무안하게 자꾸 그냥 급여 해보면 안 되겠냐는 반복적인 얘기에 전화 받은 아침부터 기분이 안 좋았습니다. 그리고 본인들이 사료를 잘못 보낸 실수에 대해선 사과 한 마디도 없었구요. 원래 연락을 하셨을 때 본인들의 과실에 대해 사과를 먼저 해야 하는 게 맞는 순서이고 정상 아닌가요 ? 제가 사과를 바란 건 아니지만, 권유하는 태도에 기분나빠 다시 생각하니 사과도 안 하셨던 그 태도에 더 기분이 나빠지더라고요. 그리고 제가 진짜 귀찮아서라도 웬만한 일에는 별점 1점 주는 리뷰는 절대 적지 않습니다. 근데 통화가 끊어진 뒤 제가 기분도 너무 좋지 않고, 사료가 잘못 오는 바람에 저희 강아지 사료가 다 떨어져 당장 오프라인으로 구매를 해야겠다는 생각에 구매 취소 하겠단 문자를 보냈었는데 곧바로 다시 전화가 와서 교환처리 해주시겠다며 사료도 하루만에 배송 될 수 있도록 하겠다고 하셔서 그냥 꾹 참고 교환처리 해달라고 말씀 드렸습니다. 근데 잠시 뒤 다시 전화와서 하신다는 말씀이 원래 주문 했던 사료보다 오배송 된 사료가 조금 더 비싼 사룐데 기존에 사료 주문 한 가격으로 주겠다며 원래 급여하는 사료를 재주문 하면 안 되겠냔 식으로 말씀을 하셔서 너무 화가 머리 끝까지 치밀어올랐습니다. 본인이 동물병원 원장이라 소개 하시던데 그럼 더 잘 아시는 거 아닌가요 ? 아날러제닉은 로얄캐닌 알러지 사료 중 제일 마지막 단계 사료로 하이퍼알러제닉 다음 단계인 사료인데, 아날러제닉 사료를 급여하게 되면 아예 다른 간식은 일체 급여 하면 안 된다는 것도 알고 계실텐데, 저희 강아지의 특성도 묻지도 않으시고 그냥 급여 계속 권유 하시질 않나 이 부분은 전화로도 말씀 드렸던 부분인데 상관 없다고 아날러제닉 그냥 급여해도 괜찮다고 하시더라구요? ㅋㅋ 인터넷 조금만 뒤져도 나오는 정보이고 제가 다니는 동물병원에 전화 해서 다시 물어보기까지 했네요. 저희 강아지가 알러지 검사 했을 때 알러지 수치가 제일 낮게 나온 것들로 해서 소량으로 과일이나 간식 같은 거 가끔 굳이 아날러제닉까진 먹일 필요 없다 판단했고, 저희 강아지 진찰 해주시는 원장님도 그렇게 말씀 하셨어요. 아무리 생각해도 이런 식의 태도는 올바르지 못 한 것 같네요. 여기서 재구매는 다신 없습니다. 다른 소비자 분들께는 이런 실수 하지 마세요. 다른 분들께도 구매 하시기 전 제 글 참고 하셨으면 해요."
5,"11살 아이인데 면역이떨어지면서 피부 알러지가붉어졌다 점차뭇거뭇 점차 늘어나서 피부에 도움되는 샴푸와 식수관리와 목욕시 타서 쓰는 것과 맘마를 바꿔 주니 지금은 병원안가고 아주 좋
11살 아이인데 면역이떨어지면서 피부 알러지가붉어졌다 점차뭇거뭇 점차 늘어나서 피부에 도움되는 샴푸와 식수관리와 목욕시 타서 쓰는 것과 맘마를 바꿔 주니 지금은 병원안가고 아주 좋와 져서 거이 완치 수준이네요.
가수분해 사료는 이제품만 잘 먹어서 수없이 바꾸다 이제 정착해서 오메가풍부한사료와 반반 섞어주면서 기운도 나고 개춘한거 같이 날라 다니니 .예전엔 늘가려워 해서 힘들었는데 지금은 그런게 없어져서 좋와요."
5,"7살 우리 강쥐는 (실키테리어 / 여. 2.6kg) 어릴때부터 피부가 지독히도 안좋아요. 결국 5살일 때부터 병원에서 치료와 처방식을 시작했는데 다행히 밥은 잘 먹어서 그 이후로
7살 우리 강쥐는 (실키테리어 / 여. 2.6kg) 어릴때부터 피부가 지독히도 안좋아요. 결국 5살일 때부터 병원에서 치료와 처방식을 시작했는데 다행히 밥은 잘 먹어서 그 이후로 쭉 이 사료만 구입합니다.
지금은 아예 다른 간식을 끊고 이 밥만 아침 저녁으로 종이컵 반컵씩 급여하고 있어요. 다른 간식을 줄 때는 귀가 시뻘개지도록 긁고 난리가 나지만 다행히 이 밥만 줄 때는 그정도까진 아니고 새벽에 잠깐씩 긁고 오는 정도예요. ㅠㅠ
간식도 못 먹는데 밥이라도 잘 먹어서 다행이라 생각해서 떨어지기 전에 시키는데 가끔 품절일 때가 있더라구요.
가격만 빼면 괜찮은 사료예요. 흐 ㅠ"
5,"태어날 때부터 피부가 민감해서 알러지 사료를 추천받은 5살 강아지가 있어요. 언제나 로열캐닌 하이포알러제닉 먹여요. 다른 사료 안 주고 이것만 꾸준히 먹이니 확실히 증상이 좋아졌어
태어날 때부터 피부가 민감해서 알러지 사료를 추천받은 5살 강아지가 있어요. 언제나 로열캐닌 하이포알러제닉 먹여요. 다른 사료 안 주고 이것만 꾸준히 먹이니 확실히 증상이 좋아졌어요. 미리 한 봉지씩 사두어 떨어지지 않게 준비하는 편이랍니다. 부탁드리고 싶은 건, 쇼핑몰에 재고가 없어서 주문을 못 하는 일이 없도록 많이 갖다 놓으시면 좋겠어요. 유기동물 돕는 일 응원하고 싶어서 꼭 사료는 여기에서 구매하고 있어요."
5,"피부가 안좋아서 이것저것 먹여보다 처방식사료가 좋다는 말에 바꿔봤는데요. 너무 잘 먹어요. 평소 밥을 잘 안 먹는 아이라 걱정이었는데 이 사료는 너무 잘 먹네요. 자꾸 밥 달라고
피부가 안좋아서 이것저것 먹여보다 처방식사료가 좋다는 말에 바꿔봤는데요. 너무 잘 먹어요. 평소 밥을 잘 안 먹는 아이라 걱정이었는데 이 사료는 너무 잘 먹네요. 자꾸 밥 달라고 졸라서 살찔까봐 조절할 정도예요. 인터넷으로 사서 저렴하게 구매해 더욱 만족합니다. 일시품절이던데 빨리 다시 저렴하게 판매해주셨으면 좋겠네요. 다 먹고 재구매하러 오겠습니다. 아 한가지 단점이 있는데 개별포장이 아니여서 그건 좀 불편하네요. 개선이 되었으면 좋겠습니다."
5,"3개를 구매 하면서 유효기간 긴 것으로 부탁드렸는데, 구매했던 사이트 중에 유효기간이 가장 넉넉한 상품으로 보내주셨어요. 1kg 이면 5주 조금더 먹는데, 4개월 정도는 잘 먹일
3개를 구매 하면서 유효기간 긴 것으로 부탁드렸는데, 구매했던 사이트 중에 유효기간이 가장 넉넉한 상품으로 보내주셨어요. 1kg 이면 5주 조금더 먹는데, 4개월 정도는 잘 먹일 수 있을 것 같아요. 다만 생산시기 마다 다른건지 알갱이 모양이 기존것 보다 좀 더 납작해지고 크기도 살짝 커졌네요. 작은게 좋았는데 살짝 아쉽지만 판매자님의 문제가 아니니 빠른 배송에 좋은 제품 오프라인보다 저렴히 구매한것에 만족합니다."
5,"멍구 밥이 다 떨어져갔는데 배송이 되게 빨라서 딱 맞았어요~아무 간식이나 사료를 먹으면 바로 피토를 하고 힘들어해서 병원에서 처방받아 먹던 사료였는데, 스몰독보다 그냥 하이포알러제
멍구 밥이 다 떨어져갔는데 배송이 되게 빨라서 딱 맞았어요~아무 간식이나 사료를 먹으면 바로 피토를 하고 힘들어해서 병원에서 처방받아 먹던 사료였는데, 스몰독보다 그냥 하이포알러제닉이 알갱이가 훨 크지만 좀 더 기름지고 칼로리가 높다해서 저희집 멍구는 원체 마른편이라 그걸먹이다가 아무래도 딱딱하고 커서 힘들어하는 것 같아서 스몰독으로 다시 갈아탔어요.~ 먹기 훨씬 편해하네요, 병원보다 싼 가격에 잘 받아갑니다.^^"
5,"알갱이 크기는 살짝 더 커졌는데, 기호성이 전보다 좋아졌어요. 무엇보다 지퍼백이라서 그런지 사료 개봉 이후 기간이 조금 경과되면 사료 쩐내가 나기 마련인데 한달 넘어도 고소한 냄새
알갱이 크기는 살짝 더 커졌는데, 기호성이 전보다 좋아졌어요. 무엇보다 지퍼백이라서 그런지 사료 개봉 이후 기간이 조금 경과되면 사료 쩐내가 나기 마련인데 한달 넘어도 고소한 냄새가 나서 댕댕이가 거부감 없이 잘 먹어요. 밥그릇에 놔둔지 하루만 지나도 새 사료 줄때까지 안먹는데, 외출이 길어질때 사료 넉넉히 부어놔도 끝까지 잘 먹어서 좋아요. 계속 저렴하게 구매 할 수 있도록 번창하세요 ^^"
5,"피부가 매우 민감한 애견이라, 단백질성 육포나 닭고기만 먹으면 피부에 가려움증 및 습진같은게 생겨 엄청 고생하고 병원비 들고 했는데, 확실히 이 사료 먹이니까 증상 호전되고, 사실
피부가 매우 민감한 애견이라, 단백질성 육포나 닭고기만 먹으면 피부에 가려움증 및 습진같은게 생겨 엄청 고생하고 병원비 들고 했는데, 확실히 이 사료 먹이니까 증상 호전되고, 사실상 이것만 먹이면 피부염 싹 없어지네요. 단 우리집은 2마리라, 다른 한넘땜에 어쩔수없이 간식을 같이 조금씩은 줘야해서 100% 효과는 못보고 있지만, 그래도 이 사료 덕에 90%의 효과는 봅니다^^"
5,"한동안 구하기 어려웠는데 간만에 이 제품이 있어 구매하게 되었네요~간당간당하게 주문해서 기다리는동안 가끔 먹는 다른 사료 3일 먹었는데 오랜기간 하이포알러제닉 스몰독 이걸 먹어 그
한동안 구하기 어려웠는데 간만에 이 제품이 있어 구매하게 되었네요~
간당간당하게 주문해서 기다리는동안 가끔 먹는 다른 사료 3일 먹었는데 오랜기간 하이포알러제닉 스몰독 이걸 먹어 그런지 3일간 대변량이 너무 많고 자주 보더라구요~ 다시 돌아가니까 역시 대변량이 줄고 하루 한두번만 보는게 신기하네요~ 밥을 넘 빨리 먹어서 여러번 나눠 주는데 그마저도 금방 먹고 달려와서 입맛 다시면서 더 달라고 해요~~"
5,"눈물 제거에 큰 효과를 본 상품. 더마x 사료를 먹였다가 눈물이 점점 늘어나고.. 원래 눈물이 많았고 눈물은 복합적 원인이라 하여 사료 바꿀생각은 못했던 시절. 그렇게 정점을 찍었
눈물 제거에 큰 효과를 본 상품. 더마x 사료를 먹였다가 눈물이 점점 늘어나고.. 원래 눈물이 많았고 눈물은 복합적 원인이라 하여 사료 바꿀생각은 못했던 시절. 그렇게 정점을 찍었던 날의 사진입니다. 결국 병원상담으로 고른 이 사료로 한두달만에 개과천선! 눈물없어 이쁘다는 칭찬 많이 들었어요. 살이 많이 찐다고 하던데 다행히 살도 안찌고 잘먹어요. 완전 정착하려고 이번에 대용량으로 사버렸네요!"
5,"피부에 진짜 좋다고 지인이 알러줘서 잠깐 다른 사료를 갈아탔는데 이상하게 강쥐 몸에서 안나던 냄새가 너무 심하게 나더라구요.그래서 의사쌤께 여쭈어 봤더니 먹는 것에 의해 몸에 냄새
피부에 진짜 좋다고 지인이 알러줘서 잠깐 다른 사료를 갈아탔는데 이상하게 강쥐 몸에서 안나던 냄새가 너무 심하게 나더라구요.
그래서 의사쌤께 여쭈어 봤더니 먹는 것에 의해 몸에 냄새가 날 수도 있다 하셔서 잠깐 갈아탔던 사료를 가감히 포기하고 다시 로얄캐닌으로 넘어왔습니다. 로얄캐닌의 봉지소리가 바스락 바스락 하기만해도 울 예쁜시끼가 달려와 코로 끙끙거리네요. 로얄캐닌 먹고 냄새안나던 예전으로 돌아갔으면 좋겠고 피부도 나아지길 바래봅니다."
5,"저희집 강아지가 식이알러지가 있어서 병원에서 추천해주신 사료인데~ 동물병원에서 구매하자이 가격이 사악할뿐더러 1kg밖에없더라구요~메번사러기기도 힘들고.. 그래서 인터넷으로 찾던중
저희집 강아지가 식이알러지가 있어서 병원에서 추천해주신 사료인데~ 동물병원에서 구매하자이 가격이 사악할뿐더러 1kg밖에없더라구요~
메번사러기기도 힘들고.. 그래서 인터넷으로 찾던중 여기가 리뷰도 많고 가격도 적당하다 생각해 구매하게되었습니다~ 저희 강아지 이 사료에 환장하는데, 알러지도 안올리와서 그게 너무 좋아요!! 사료또 떨어지면 여기서 구매할꺼예요!
배송은 말해뭐해유~ 짱짱빨리왔습니다😊👍"
5,"품절이었는데 담날 오전에 혹시나싶어 확인했더니 풀렸길래 바로결제했어요..ㅎ 소리지를뻔했네요..너무 좋아서..ㅎ 요즘 사료가 수입이 잘 안되나봐요..아닌가..암튼 가격이 많이 오른것
품절이었는데 담날 오전에 혹시나싶어 확인했더니 풀렸길래 바로결제했어요..ㅎ 소리지를뻔했네요..너무 좋아서..ㅎ 요즘 사료가 수입이 잘 안되나봐요..아닌가..암튼 가격이 많이 오른것같기도하고 특히 이 사료가..이 용량이 귀하더라구요..한참 코로나로 난리일때 광클로 마스크 구매한듯한 기분..ㅋㅋ 감사해요..많이파세요..ㅎ"
5,"15살 개르신맘 입니다 여태껏 아무반응없이 다 잘먹었던 아이였는데 갑자기 알러지 반응이 일어나서 엄청긁고 난리도아니였어요 의사쌤이 간식 일절 안돼고 사료부터 바꿔야 한다고 하셔서
15살 개르신맘 입니다 여태껏 아무반응없이 다 잘먹었던 아이였는데 갑자기 알러지 반응이 일어나서 엄청긁고 난리도아니였어요 의사쌤이 간식 일절 안돼고 사료부터 바꿔야 한다고 하셔서 동물병원에서 샘플 주신거 먹여보고 바로 구매했어요
다행이도 너무 잘 먹네요 가수분해알러지 사료 고민하시는 분 있으시면 무조건 로얄캐닌 하세요"
5,"사료편식이 엄청 심해서 지금까지 제대로 먹은 사료 없었는데 완전 성공 입니다(8개월 토이푸들 암컷 5키로)다른 사료들은 물넣고 전자렌즈 돌려주면 잘 먹는다 해서 이것저것 시도 해봤
사료편식이 엄청 심해서 지금까지 제대로 먹은 사료 없었는데 완전 성공 입니다(8개월 토이푸들 암컷 5키로)

다른 사료들은 물넣고 전자렌즈 돌려주면 잘 먹는다 해서 이것저것 시도 해봤는데 번번히 실패했었어요 ㅠㅠ

눈물이 살짝 있어서 알러지 사료 찾다가 한번 시도해봤는데 왠걸 간식으로 줘도 먹을정도에요

쫒아다녀요

피부에 좋다 하니 조금더 지켜보려고 합니다"
5,"저희 애들은 포메인데 둘다 눈물하고 피부가 예민해서 알러지사료를 먹이는데요~! 처음코로나전에는 두마리여도 5만원돈에 3.5키로 사료를 구입할 수있어서 부담이없었는데 어느순간 가격이
저희 애들은 포메인데 둘다 눈물하고 피부가 예민해서 알러지사료를 먹이는데요~! 처음코로나전에는 두마리여도 5만원돈에 3.5키로 사료를 구입할 수있어서 부담이없었는데 어느순간 가격이 치솟더라구요ㅠㅠ진짜 10만원에 파는곳이 대부분이고ㅠㅠ두마리다보니 한달이면 사료가 바닥납니다ㅜㅠ 둘찌는 홍역증흐군이라 밥을 먹어도 씹지않고 흡입해서 배고픔도 더많이 느껴서 밥도 많이먹고ㅜㅠ그래서 늘사료사는데 부담인데 펫비앙은 제일 착한가격에 강아지들은 진짜 사랑하시는분이 운영하시는거같아요! ㅠㅠ빨리 본사에서 물량을 많이풀어서 애들사료 두팩씩 사놓고싶어요ㅠㅠ떨어질때되면 다품절이라 초조한데 펫비앙은 늘 친절히 상담해주시고 안내해주셔서 감사합니다👉👈❤👍"
5,"안먹을까 걱정했는데 굉장히 잘먹네요. 그리고 급여량이 표기되어있어 정확히 급여중입니다. 지루성피부염인데 힐스zd는 안먹어 고생이었어요. 잘먹으면서 피부도 전보다 조금 좋아지는듯해
안먹을까 걱정했는데 굉장히 잘먹네요. 그리고 급여량이 표기되어있어 정확히 급여중입니다. 지루성피부염인데 힐스zd는 안먹어 고생이었어요. 잘먹으면서 피부도 전보다 조금 좋아지는듯해요.시뻘겋고 각질벗겨지던게 여러가지 요인을 바꾸긴했지만, 그중의 하나인 사료도 맞지 않나 싶을정도로 개선중이에요. 2주정도 급여했네요 이제"
5,"늘 먹는 사료이고 한달전 미리 구입해놨다 3개월안에 소비하니 유통기한보단 가격이 싼곳에서 주문을하는데 이번에는 이 사이트가 가격이 좋았어요 그런데 타사이트에 비해 제품 포장이 꼼꼼
늘 먹는 사료이고 한달전 미리 구입해놨다 3개월안에 소비하니 유통기한보단 가격이 싼곳에서 주문을하는데 이번에는 이 사이트가 가격이 좋았어요 그런데 타사이트에 비해 제품 포장이 꼼꼼하고 군더더기가 없으셔요. 새벽주문해 바로 출고돼 다음날 바로 받았어요. ㅋㅍ로켓배송 못지않네요^^ 잘먹일게요. 가격이 계속좋다면 쭉 재구매의사 있습니다. 더번창하셔요^^"
5,"펫비앙에서 세 번째 구매입니다! 젤 저렴하게 살 수 있어 좋어용. 7kg 푸들 3.5kg 한 포대 딱 한 달 정도 먹는 것 같아요. 식이알러지+아토피 있는 아이인데 병원에서 가수분
펫비앙에서 세 번째 구매입니다! 젤 저렴하게 살 수 있어 좋어용. 7kg 푸들 3.5kg 한 포대 딱 한 달 정도 먹는 것 같아요. 식이알러지+아토피 있는 아이인데 병원에서 가수분해 처방식 사료 먹이는 게 중요하다 하시더라구요! 간헐적으로 주사 치료도 병행하고 있지만 로얄캐닌하이포알러제닉 사료 꾸준히 먹는 것도 많이 도움되는 것 같아요. 💖"
1,"정품이 아닌건지? 이제품 먹고 눈물이 많이생겼습니다 1주일 2주일 3주일되니 깨끗했던눈이 위아래 젖어있고 눈아래는 점점 검정색으로 변하더라고요 앞발로 눈을 자꾸비비고 씻겨주고 닦
정품이 아닌건지? 이제품 먹고 눈물이 많이생겼습니다 1주일 2주일 3주일되니 깨끗했던눈이 위아래 젖어있고 눈아래는 점점 검정색으로 변하더라고요 앞발로 눈을 자꾸비비고 씻겨주고 닦아줘도 눈물이 그렁그렁 맺히네요
혹시 몰라 동물병원가서 평소먹던거 똑같은상품용량만 작은 1kg사왔는데 1주일 먹고 좋아지는게 눈에 확 뛰네요 다음부터는 못사겠네요"
5,"식이성알러지가 생겨서 하이포알러제닉으로 바꿨어요. 기분에따라 다른건지 먹었다,안먹었다하지만 그래도 나름 잘먹는편이에요.처음엔 응아가 질어져서 걱정스러웠는데 이제 두달째다보니 자리를
식이성알러지가 생겨서 하이포알러제닉으로 바꿨어요. 기분에따라 다른건지 먹었다,안먹었다하지만 그래도 나름 잘먹는편이에요.처음엔 응아가 질어져서 걱정스러웠는데 이제 두달째다보니 자리를 잘 잡고 있나봅니다. 병원보다 저렴한가격으로 구매하니 기분 좋았어요~^^ 그런데 택배배송 오류로 너무 시간이 오래걸렸답니다. 담번 주문할땐 주말끼지않고 미리미리 주문해야겠어요.
그런데 스몰독과 큰알갱이 알러제닉은 사이즈 차이만 있는건가요?"
5,"저희집 말티즈가 사료알러지가 심해서 조금이라도 잘못먹으면 눈물폭탄되고 발바닥 핥느라 잠도 못자는데 이거 먹이면 괜찮아져요눈물자국 없애려고 이것저것 알아봤는데 저는 이 사료먹이고 눈
저희집 말티즈가 사료알러지가 심해서 조금이라도 잘못먹으면 눈물폭탄되고 발바닥 핥느라 잠도 못자는데 이거 먹이면 괜찮아져요
눈물자국 없애려고 이것저것 알아봤는데 저는 이 사료먹이고 눈주변에 발라주는 파우더 구매해서 눈물자국 없앴어요!!
비싸가지고 잠깐 다른거 먹이다가 다시 주문해서 급여해줬는데 바로 허겁지겁 먹더라구요ㅠㅠ 비싸더라도 이것만 먹여야겠어요.. !!!"
5,"알러지 사료라 안먹을까 걱정했는데, 일단 냄새부터 엄청 맛있는 냄새가 나고 줬더니 진짜 잘먹어요! 기존에 먹던거랑 섞어서 급여 중인데 변이 살짝 무르게 나오는거 같아서 당분간은 기
알러지 사료라 안먹을까 걱정했는데, 일단 냄새부터 엄청 맛있는 냄새가 나고 줬더니 진짜 잘먹어요! 기존에 먹던거랑 섞어서 급여 중인데 변이 살짝 무르게 나오는거 같아서 당분간은 기존 먹던 사료 비율을 좀 더 늘려서 서서히 바꿔야 할거 같아요. 아직 효과는 모르겠지만 꾸준히 급여해보려구요. 부디 이거 먹고 알러지 좋아지길 바랍니다."
1,"귀찮아서 상품평 안남기는데 이건 어이가없어서 써요 다른분들 피해받지말라고 참고하시라고 씁니다 무슨 택배가 박스도없이 본품그대로에 송장하나 달랑붙여서 보내고 ,유통기한도 고작 1년남
귀찮아서 상품평 안남기는데 이건 어이가없어서 써요 다른분들 피해받지말라고 참고하시라고 씁니다
무슨 택배가 박스도없이 본품그대로에 송장하나 달랑붙여서 보내고 ,유통기한도 고작 1년남은거 보내나요? 얼척이없어서 정말
급하게보낸다고 이렇게 보낸겁니까? 그렇다고 빨리온것도아닌데요? 두번다신 여기서 안삽니다"
4,"전에 1kg단위포장은 잘구위진듯한 색감이었는데 이번거는 그냥 노르스름해서 그런지 더 바삭하지 않은 느낌이에요. 아이가 먹을때도 바삭거리는 소리도 잘 나지않고 먹다가 자꾸 뱉어내곤해
전에 1kg단위포장은 잘구위진듯한 색감이었는데 이번거는 그냥 노르스름해서 그런지 더 바삭하지 않은 느낌이에요. 아이가 먹을때도 바삭거리는 소리도 잘 나지않고 먹다가 자꾸 뱉어내곤해요.(ㅠ 왜그럴까요? 같은 상품인데....)
조금더 저렴한듯 싶어 큰포장으로 샀는데 담부턴 소포장으로 살까봐요.
그래도 저렴하게 잘샀습니다~^^"
