rate,review
5,"동물병원에서 샘플로 받은거 먹여보고 너무 잘 먹어서 바로 샀어요. 같은 사료를 좀 오래 먹였어서 다른거 먹여주고 싶었는데 맛있게 먹는 사료 찾기 힘들었거든요. 근데 금식하다 먹어서
동물병원에서 샘플로 받은거 먹여보고 너무 잘 먹어서 바로 샀어요. 같은 사료를 좀 오래 먹였어서 다른거 먹여주고 싶었는데 맛있게 먹는 사료 찾기 힘들었거든요. 근데 금식하다 먹어서 그랬을진 모르겠으나.. 그 많은 양을 다 먹기도 했고 제가봐도 사료가 너무 맛있어보였어요 ㅋ 그리고 나이 먹어가며 피부도 안 좋아져서 피부관련 사료 먹여보자 해서 기존에 먹던 사료랑 섞어서 먹이고 있습니다."
5,"두반려견 아이를 키우고 있어요! 9살6살 된 아이인데, 한 아이는 결석수술후 결석처방사료를 지급해야 할 상황이였고 한 아이는 알러지가 심해 알러지처방 사료를 먹여야만 하는 상황이였
두반려견 아이를 키우고 있어요! 9살6살 된 아이인데, 한 아이는 결석수술후 결석처방사료를 지급해야 할 상황이였고 한 아이는 알러지가 심해 알러지처방 사료를 먹여야만 하는 상황이였죠, 두아이 가 먹는 처방식 사료가 달라 찾다찾다 두아이 모두에게 먹여도 되는 로얄캐닌 하이포 알러지 를 찾게 된거예요! 기호성도 얼마나 좋은지 까다롭던 아이들이 사료만 보면 환장을 해요~~
가격도 병원에서 구매 하는것 보다 훨씬 저렴해서 벌써 반년 넘게 펫비앙 에서만 구매 합니다!
택배 배송도 빠른편이라 거의 하루이틀 정도의 먹일양이 남을때 주문하면 하루이틀 총알 배송이라 너무 편해요 (๑˃̵ᴗ˂̵)"
5,"알러지 사료 중 제일 유명한 사료죠. 로얄캐닌 말은 많다지만 저는 큰 회사고 병원에서 취급하는 제품이니 믿고 샀습니다. 일주일 먹였는데 다행히 큰 문제없이 잘 먹어요. 입이 워낙
알러지 사료 중 제일 유명한 사료죠. 로얄캐닌 말은 많다지만 저는 큰 회사고 병원에서 취급하는 제품이니 믿고 샀습니다. 일주일 먹였는데 다행히 큰 문제없이 잘 먹어요. 입이 워낙 까다로운 아이라 어떤 시료를 먹여도 잘 안먹어서 기호성은 뭐라 말씀드리기 애매하네요~ 먹고 아이 소양감이 줄어들면 좋겠습니다."
5,"다섯살 푸들 남아에요 입맛이 까다로운편이에요~원래는 하림 더리얼 연어맛 구운걸로다가 먹였었는데 눈물자국도 그닥 나아지질 않고 애가 간식 알러지도 있어 몸통 긁기가 심해져서 다시 먹
다섯살 푸들 남아에요 입맛이 까다로운편이에요~원래는 하림 더리얼 연어맛 구운걸로다가 먹였었는데 눈물자국도 그닥 나아지질 않고 애가 간식 알러지도 있어 몸통 긁기가 심해져서 다시 먹이려고 구매했어요~6키로라 큰알도 작은알도 잘 먹는데 작은걸로 구매했어요~제품 엄청 잘먹는건 아니여도 아주 안먹는건 아니라 기호성이 나쁜것 같지는 않네요 빠른 배송도 좋았어요"
3,"다 좋은데.. 사료 두개를 너무 작은 상자에 보내신거같애요찢어지고 막 튀어나오고 .. 제가 다른곳에서 주문한 영양제가온줄알았네요. 박스가 하도작아서.코로나로 힘드신건알겠는데..사료
다 좋은데.. 사료 두개를 너무 작은 상자에 보내신거같애요
찢어지고 막 튀어나오고 .. 제가 다른곳에서 주문한 영양제가온줄알았네요. 박스가 하도작아서.
코로나로 힘드신건알겠는데..사료 한봉지도 아니고 두봉진데..
좀 넉넉한 박스에넣어주시지..
어찌됐건 상품은 잘 받았습니다.."
5,"알러지로 가려움증 심해 병원 처방받고 추가로 주문 했는데 여기가 젤 저렴하더라구요기호성 엄청 좋은것 같아요두 살 된 새끼도 아침엔 입맛이 없는지 안먹으려 하는데 이거 몇 알 섞어서
알러지로 가려움증 심해 병원 처방받고 추가로 주문 했는데 여기가 젤 저렴하더라구요
기호성 엄청 좋은것 같아요
두 살 된 새끼도 아침엔 입맛이 없는지 안먹으려 하는데 이거 몇 알 섞어서 밥 주면 잘 먹어서 너무 좋네요
구입해 놓은 사료 다 먹이고 나면 새끼도 어미랑 함께 이 사료로 바꿔줘야겠어요^^"
5,"눈물이 터져서 유명한 벨포아사료를 먹여봤지만 먹는걸 좋아하던 아이가 유일하게 벨포아는 싫어하더라구요 ㅠㅠ 그리고 알러지반응이있어서 이 사료로 바꿨는데 기호성도 너무 좋고(밥을 다시
눈물이 터져서 유명한 벨포아사료를 먹여봤지만 먹는걸 좋아하던 아이가 유일하게 벨포아는 싫어하더라구요 ㅠㅠ 그리고 알러지반응이있어서 이 사료로 바꿨는데 기호성도 너무 좋고(밥을 다시 너무 좋아해요)간혹 눈꼽끼는정도라 만족합니다 다만 흠이면 비싼거?!ㅠ 그래도 아이가 좋아하니 또 재구매하면서 리뷰 남겨요"
5,"생후2개월때 로얄캐닌 잠깐 먹이고 다른걸로 갈아타서 돌지날때꺼지 먹였눈데갑자기 눈물이 터져서 이것저것 바꾸던 중지인추천으오 다시로얄캐닌으로 넘어왔네요아직 먹은지 채 한달도 되지 않
생후2개월때 로얄캐닌 잠깐 먹이고
다른걸로 갈아타서 돌지날때꺼지 먹였눈데
갑자기 눈물이 터져서 이것저것 바꾸던 중
지인추천으오 다시로얄캐닌으로 넘어왔네요
아직 먹은지 채 한달도 되지 않아 완전한 효과를 바라긴 어렵지만 점차 나아갔음 좋겠네요
효과 있음 한달두ㅏ에 다시 리뷰 쓰러올게요~"
3,"다른 사료성분때문에 눈물도 많아지고해서 샀어요앞으로 이것만 먹이려구요~먹는건 큰알 아니믄 다 잘먹어 다행이네요~처방식사료가 참 좋긴해요 뭣모르고샀다간 엄지손톱만한 사료알 산적있어서
다른 사료성분때문에 눈물도 많아지고해서 샀어요
앞으로 이것만 먹이려구요~먹는건 큰알 아니믄 다 잘먹어 다행이네요~처방식사료가 참 좋긴해요 뭣모르고샀다간 엄지손톱만한 사료알 산적있어서 뿔려줬던 기억이..근데 요건 스몰독이라 적당하고 좋습니다"
5,"아주정확한 후기에요 우리강아지가 미친듯이 먹어요우리 강아지는 사료를 아주 싫어해서 버티다버티다 마지막에 배고프면 먹는애였거든요 하루에 한끼 먹으면 마니 먹고 사람음식이랑 간식에 길
아주정확한 후기에요 우리강아지가 미친듯이 먹어요
우리 강아지는 사료를 아주 싫어해서 버티다버티다 마지막에 배고프면 먹는애였거든요 하루에 한끼 먹으면 마니 먹고 사람음식이랑 간식에 길들여져서 그래요
근데 이사료 피부때문에 산거였는데 피부에는 솔직히 별로 효과 없는거같은데 진짜 잘먹어요 사료를 놓자마자 먹어요ㅋㅋ
그래서 아주 맘에드네요"
5,"발을 너무 심하게 핥아서 병원에 갔더니추천해주신 사료에요그 이후로 몇년간 계속 재구매해서 먹고있는데 지금 코로나 사태로 수입이 원활하지 않은지 가격도 오르고 물량도 모자란 상태네요
발을 너무 심하게 핥아서 병원에 갔더니
추천해주신 사료에요
그 이후로 몇년간 계속 재구매해서 먹고있는데 지금 코로나 사태로 수입이 원활하지 않은지 가격도 오르고 물량도 모자란 상태네요
그래도 원래 가격이랑 심하게 차이 나지 않는 스토어를 찾게 되어 다행입니다😊"
5,"알러지때문에 사료 바꾸면서 먼저 샀던거 다먹고 추가로 더 구매했는데 좀 깨작거리네요. 입이 짧은 강아지긴 해서 봉지마다 미묘하게 다른 어떤걸 느끼는건지. 암튼 꾸준히 먹여봐야죠.
알러지때문에 사료 바꾸면서 먼저 샀던거 다먹고 추가로 더 구매했는데 좀 깨작거리네요. 입이 짧은 강아지긴 해서 봉지마다 미묘하게 다른 어떤걸 느끼는건지. 암튼 꾸준히 먹여봐야죠. 알이 작아서 치와와 먹기에 사이즈는 좋아요."
5,"알러지가 심해서 이 제품 말고는 아무것도 안 먹여요. 기호성이 좋아서 주식으로 간식으로 잘 먹이고 있습니다.소소한 팁: 강아지가 물을 잘 안마시면, 이거 몇 알 물에 담아서 줘보세
알러지가 심해서 이 제품 말고는 아무것도 안 먹여요. 기호성이 좋아서 주식으로 간식으로 잘 먹이고 있습니다.
소소한 팁: 강아지가 물을 잘 안마시면, 이거 몇 알 물에 담아서 줘보세요. 개바개겠지만, 물 안먹어서 고민이던 우리집 개는 완전... 접시 바닥까지 다 마실 기세네요😅"
5,"7년된 콩아리와 꼬맹이 보호자예요~ 콩아리가 자가면역질환에 걸려 병원에서 추천해주셔서 먹이기 시작햇는데 맛도 고소하고 크기도 적당해 잘 먹고들 있어요~ 오도독
7년된 콩아리와 꼬맹이 보호자예요~ 콩아리가 자가면역질환에 걸려 병원에서 추천해주셔서 먹이기 시작햇는데 맛도 고소하고 크기도 적당해 잘 먹고들 있어요~ 오도독 오도독 맛나게 먹을때는 제가낳은 새끼인양ㅋ 넘 기특하구요^^! 배송도 빨리 해 주셔서 불편함없이 급여하고 있답니다~^^"
4,"일단 엄청 잘 먹어요! 개아들이 먹는거에 예민해서 어렸을때부터 알러지용수제사료만 먹이다가 질렸는지 잘 안먹길래 한번 구매해봤습니다,논란이 있었던 사료라 반신반의 해서 구매하긴 했는
일단 엄청 잘 먹어요! 개아들이 먹는거에 예민해서 어렸을때부터 알러지용수제사료만 먹이다가 질렸는지 잘 안먹길래 한번 구매해봤습니다,
논란이 있었던 사료라 반신반의 해서 구매하긴 했는데 일단 잘 먹고 변도 잘 보내요~ 알러지 효과는 좀 지켜 봐야 할 거 같아요, 피부랑 눈물이 먹는거에 엄청 예민하게 반응하는 애라 효과가 있음 좋겠어요,"
5,"소화력이 부족해서 이 사료로 꾸준히 먹이고 있어요. 토하는게 아예 없어진게 아니지만 컨디션 많이 안좋을때 말고는 현저히 줄었어요. 그리고 알러지 전용 사료라 그런지 눈물샘이 사라진
소화력이 부족해서 이 사료로 꾸준히 먹이고 있어요. 토하는게 아예 없어진게 아니지만 컨디션 많이 안좋을때 말고는 현저히 줄었어요. 그리고 알러지 전용 사료라 그런지 눈물샘이 사라진게 가장 신기해요. 동물병원에서 추천해주신 사료인 만큼 믿고 계속 먹일 예정이에요"
5,"다른집 말티즈가 눈물없이 눈이 깨끗해서 무얼먹고 있냐고 물어보니 로얄캐닌 하이포알러제닉 스몰독 먹고 있다고 하길래 구매해보았어요 사료가 기름이 많은 느낌이고 냄새는 심하지 않아요
다른집 말티즈가 눈물없이 눈이 깨끗해서 무얼먹고 있냐고 물어보니 로얄캐닌 하이포알러제닉 스몰독 먹고 있다고 하길래 구매해보았어요 사료가 기름이 많은 느낌이고 냄새는 심하지 않아요 말티즈 울 막내 잘먹어요 변 냄새도 없고 눈물도 좀 주는것 같고요 눈물이 개서되어 눈가가 깨끗해지면 계속 먹일꺼예요"
5,"알러지 때문에 매일 제 살을 깨물며 잠도 잘 자지 못하던 울집 강아지가 이거 먹은 후로 괜찮아졌습니다. 원래 먹던 알러지 사료가 너무 커서 일일이 빻아서 주곤 했는데 이번에 구입한
알러지 때문에 매일 제 살을 깨물며 잠도 잘 자지 못하던 울집 강아지가 이거 먹은 후로 괜찮아졌습니다. 원래 먹던 알러지 사료가 너무 커서 일일이 빻아서 주곤 했는데 이번에 구입한 제품은 소형견용 사료라 그냥 줘도 잘 먹네요. 가격이 착해서 더 마음에 듭니다. 번창하세요.^^"
4,"좋아요
저희 애들이 비숑인데 선천적으로 피부가 좋지 못해서 병원의 추천으로 먹이기 시작했어요. 막 눈에 띄게 좋아진건 아니에요. 여전히 긁고 핥고 하지만 심했던 때를 생각해보면 그래도 계속 먹이는게 좋겠다 싶어 먹이고 있습니다. 다행히 기호성은 나쁘지 않아요."
1,"26일 오전에 주문했는데 7일 만에 받네요 그동안 애기 간식만 먹였습니다 ~ 애초에 전화주셔가지고 주시지도 않을 조그마한 사료 더 준다는 말씀 하지말지 그러셨어요 그럼 이런 평도
26일 오전에 주문했는데 7일 만에 받네요
그동안 애기 간식만 먹였습니다 ~
애초에 전화주셔가지고 주시지도 않을 조그마한 사료 더 준다는 말씀 하지말지 그러셨어요 그럼 이런 평도 안 남겼을텐데요 쓸데없는 로얄캐닌 샘플 밥 그릇 잘 받았습니다 ^^"
5,"두번째 구매입니다. 피부알러지있어 처방식으로 투여하라는 의사선생님 권유로 처음 먹일땐 입자가 굵은걸 먹이다가 작은입자로 바꾸면서 더 잘 먹는거 같아요.사료나 샴푸를 바꾸고 귀소독을
두번째 구매입니다. 피부알러지있어 처방식으로 투여하라는 의사선생님 권유로 처음 먹일땐 입자가 굵은걸 먹이다가 작은입자로 바꾸면서 더 잘 먹는거 같아요.
사료나 샴푸를 바꾸고 귀소독을 잘 했더니 피부도 많이 좋아져서 늘 같은 사료 먹일작정입니다. 좋은 가격에 구매했고 소포장이라 신선하게 먹일수 있어 좋아요. 적극 구매 추천합니다"
4,"좀 더 먹여봐야 알 수 있을것 같습니다.
원래 계속 먹어오던 사료가 있지만 우리 강아지가 하도 눈물을 많이 흘려 눈물 자국이 생기길래 눈물이 안 나온다는, 적어도 훨씬 덜 나온다는 개사료를 사봤습니다. 잘 안먹길래 먼저 먹던것과 섞어서 줘봤는데 좀 더 있어봐야 효과가 있는지 없는지 알 수 있을것 같습니다. 갑자기 설사를 하는데 사료를 바꿔서인지 아니면 아무런 관계가 없는지 아직은 알 수가 없습니다...."
5,"알러지 원인이 정확히 어떤거 인지 몰라 추측만 할 뿐인데 병원 추천 받아서 먹고 그나마 많이 좋아진 것 같아 계속 먹이고 있어요 사실 영양분이 충분할까 걱정도 되지만 다른 것 먹으
알러지 원인이 정확히 어떤거 인지 몰라 추측만 할 뿐인데 병원 추천 받아서 먹고 그나마 많이 좋아진 것 같아 계속 먹이고 있어요 사실 영양분이 충분할까 걱정도 되지만 다른 것 먹으면 벌겋게 오르고 엄청 가려워하니 어쩔 수 없어요"
5,"로얄캐닌 말 많아도 하이퍼알러제닉 상품으로 댕댕이 알러지를 잡은 사람입니다 소형 푸들인데도 그동안 대형견용인 모더레이트(사진상 왼쪽)를 먹다가 첨으로 스몰독을 시켜봤어요 테스트로
로얄캐닌 말 많아도 하이퍼알러제닉 상품으로 댕댕이 알러지를 잡은 사람입니다 소형 푸들인데도 그동안 대형견용인 모더레이트(사진상 왼쪽)를 먹다가 첨으로 스몰독을 시켜봤어요 테스트로 몇 알 먹였는데 잘 먹어요 모더레이트와 스몰독 알갱이 비교샷 올려드려요 확실히 스몰독은 알갱이가 쬐만하네요 그래도 저희 댕댕이가 잘 씹어 삼키는 것 같아요"
5,"알러지가 있는 강아지를 키우고 있어요~~항상 근처 동물병원에서 아날러제닉을 사먹였었는데 들고오기 무거워서 찾아보니 저렴하게 팔아서 구매해봤는데 배송도 빠르고 가격도 저렴해서 너무
알러지가 있는 강아지를 키우고 있어요~~항상 근처 동물병원에서 아날러제닉을 사먹였었는데 들고오기 무거워서 찾아보니 저렴하게 팔아서 구매해봤는데 배송도 빠르고 가격도 저렴해서 너무 만족스러워요!!몇번 구매해보니 안 사실인데 코야펫에서 등급별 할인해택도 주네요ㅎㅎ계속 이 사료 먹이시는 분은 꾸준하게 구매하시면 해택 많이 보실 것 같아요!-원래 아날러제닉을 먹였었는데 하도 안먹어서 변도 갈라지고 사료도 안줄어거 하이포알러제닉으로 바꿨는데 확실히 잘먹어요ㅎㅎ만약 사료 잘 안먹는 아이를 키우고 있다면 하이포알러제닉 먹여보시는 것도 좋을 것 같아요앞으로 계속 구매할게요 저렴한 가격에 빠른 배송 다 감사합니다!!"
5,"피부가 난리도 아니어서 사료를 바꿔봤는데 사료만으론 안되는거 같아요로얄캐닌은 워낙 기호성이 좋아서 애들이 잘먹긴합니다요즘 공급이 안된다고 해서 이리저리 찾아서 두개씩 구매하고 있는
피부가 난리도 아니어서 사료를 바꿔봤는데 사료만으론 안되는거 같아요
로얄캐닌은 워낙 기호성이 좋아서 애들이 잘먹긴합니다
요즘 공급이 안된다고 해서 이리저리 찾아서 두개씩 구매하고 있는데 가격이 만만치않아서 많이 사놓고 싶어도 부담이 되네요 공급이 원활해졌으면 합니당"
5,"늘 병원에서 구입하다가 진료 가지 않아도 되서 귀찮기도 하고 해서 인터넷 검색해보니 병원하고 제일 가격이 비슷해서 시켰어요~병원가는 기름비나 택배비 하면 거의 똑같더라고요~가격 변
늘 병원에서 구입하다가 진료 가지 않아도 되서
귀찮기도 하고 해서 인터넷 검색해보니 병원
하고 제일 가격이 비슷해서 시켰어요~
병원가는 기름비나 택배비 하면 거의 똑같더
라고요~
가격 변동만 없으면 여기서 계속 시키고 싶네요~
단점이 한개 추가 할때마다 택배비가….
한꺼번에 많이 시켜놓고 싶은데 그런 단점이
조금 아쉽네요~~~
사료가 작아서 울아가 잘 먹네요~
2주도 안되서 한봉지 뚝딱~^^"
4,"배송은 하루만에 받았습니다. 피부때문에 아날러제닉 먹이다가 알갱이도 너무 크고 기름져서 이제품으로 바꿔봤는데 다행히 잘 먹어주네요. 사료가 더 작고 납작한편이고 좀더 비릿한 냄새가
배송은 하루만에 받았습니다. 피부때문에 아날러제닉 먹이다가 알갱이도 너무 크고 기름져서 이제품으로 바꿔봤는데 다행히 잘 먹어주네요. 사료가 더 작고 납작한편이고 좀더 비릿한 냄새가 나요. 피부 문제만 안생기면 계속 먹이려구요~"
5,"하이포는 넘비싸서 사기전에 가격비교하고 사게되는데요 가격 잘맞는걸 찾아서 바로 구매했습니다! 배송두 빠르구 좋네요^^ 거희 2년째 먹이고있는데 강아지들이 면역력이 약한편이라 알러지
하이포는 넘비싸서 사기전에 가격비교하고 사게되는데요 가격 잘맞는걸 찾아서 바로 구매했습니다! 배송두 빠르구 좋네요^^ 거희 2년째 먹이고있는데 강아지들이 면역력이 약한편이라 알러지 잘생기는데 이사료 먹고난후로는 알러지같은거없어지고 좋아졌습니다 ! 담에도 또구매할게요"
5,"인터넷에서 전부 품절이라 구하기 힘들었는데 여기서 땋 판매하시더라고요ㅠㅠ 배송도 꽤 걸릴줄 알고 걍 맘 비우고 있었는데 오잉?! 다음날인가 바로 왔었어요! 알갱이가 꽤 작고 노란색
인터넷에서 전부 품절이라 구하기 힘들었는데 여기서 땋 판매하시더라고요ㅠㅠ 배송도 꽤 걸릴줄 알고 걍 맘 비우고 있었는데 오잉?! 다음날인가 바로 왔었어요! 알갱이가 꽤 작고 노란색을 띤 사료네요. 아토피가 좀 있어서 저알러지 사료로 추천받아서 샀는데 워낙 입맛 까다롭고 입이 짧아서 그런지 잘 안먹네요ㅠㅠ 다른 사료도 다 마찬가지로 안먹고 그나마 로얄캐닌 어덜트는 조금 먹긴하길래 같은 제조사 제품이라 잘먹을줄 알았는데ㅠㅠ 꾸준히 먹여보려고 하고 먹여볼려고요! 빠르게 보내주셔서 감사합니다~"
5,"강쥐 두마리 키우는데 알러지 때문에 항상 이 사료를 먹이고 있어요사료가 떨어졌는데 명절 다음이라 그랬는지 다 른사이트들 다 품절에 너무 터무니 없이 비싸고 그러던데 여기서 구입해서
강쥐 두마리 키우는데 알러지 때문에 항상 이 사료를 먹이고 있어요
사료가 떨어졌는데 명절 다음이라 그랬는지 다 른사이트들 다 품절에 너무 터무니 없이 비싸고 그러던데 여기서 구입해서 천만 다행이었습니다
아가들도 잘 먹고 배송도 빨리되서 좋았습니다"
5,"로얄캐닌은 기호성 최고인건 알았는데, 정말 간식처럼 좋아하면서 먹더라구요~하얀 강아지라 눈물 관리 때문에 돌고돌아 이 사료를 선택해봤는데 몇일 밖에 아직 안먹였는데도 조금 효과가
로얄캐닌은 기호성 최고인건 알았는데, 정말 간식처럼 좋아하면서 먹더라구요~
하얀 강아지라 눈물 관리 때문에 돌고돌아 이 사료를 선택해봤는데 몇일 밖에 아직 안먹였는데도 조금 효과가 있는거 같아요. 아직 확실한 효과는 모르지만 꾸준히 먹여볼려규용"
5,"알러지 케어 제품 다 품절이라 구하기 어려웠는데 여기에 있어서 당장 주문했어요! 사료 이걸로 바꾸고 눈 주변 붉어졌던 증상도 거의 없어졌고 강쥐가 아주 잘 먹어요! 사료 다 떨어져
알러지 케어 제품 다 품절이라 구하기 어려웠는데 여기에 있어서 당장 주문했어요! 사료 이걸로 바꾸고 눈 주변 붉어졌던 증상도 거의 없어졌고 강쥐가 아주 잘 먹어요! 사료 다 떨어져가서 빠른 주문 부탁드린다고 했는데 진짜로 빨리 보내주셨어요 감사합니다 또 사러올게요!"
5,"비숑 키우는데 하이포알러제닉 사료로 바꾼뒤 울 개님 눈물이 없어졌어요. 눈물잡으려구 정말 거의 2년동안 많은 사료를 바꿔 먹이면서 사료 유목민 생활을 해왔는데 우연하게 이사료를
비숑 키우는데 하이포알러제닉 사료로 바꾼뒤 울 개님 눈물이 없어졌어요. 눈물잡으려구 정말 거의 2년동안 많은 사료를 바꿔 먹이면서 사료 유목민 생활을 해왔는데 우연하게 이사료를 먹인뒤로 부터 지금은 완전히 없어졌네요. 정말 행운입니다. 이번이 3번째 재구매인데 정말 만족합니다.
울 개님에게는 잘맞아서 계속 구매할 생각입니다."
5,"강아지가 피부병이있어서 항상 근처에 동물병원이나 애견용품 파는곳에 가서 구매했는데 금방금방 먹는데 비싼거같아서 인터넷 찾다가 3.5키로에 이정도 가격이면 오프에서 사는거보다 이득인
강아지가 피부병이있어서 항상 근처에 동물병원이나 애견용품 파는곳에 가서 구매했는데 금방금방 먹는데 비싼거같아서 인터넷 찾다가 3.5키로에 이정도 가격이면 오프에서 사는거보다 이득인거같아서 구매했어요~! 유통기한도 넉넉하고 괜찮네요~ 이제부터 여기서 구매해야겠어용"
5,"내가 먹구싶을정도로 먹는소리가 사각사각 맛나게먹는울집포메 라이, 말티즈 또이도 넘잘먹어요 요거덕분에 ㅍ메인라이 급눈물도 없어졌구요 또이는 귀로왔었는데 이제 다나았어요 병원비도 음청
내가 먹구싶을정도로 먹는소리가 사각사각 맛나게먹는울집포메 라이, 말티즈 또이도 넘잘먹어요 요거덕분에 ㅍ메인라이 급눈물도 없어졌구요 또이는 귀로왔었는데 이제 다나았어요 병원비도 음청들어갔구요 이젠 함부로 밥 바꾸는일 절대 없씀요 요거열심히먹이려구요 너무좋아요"
5,"댕댕이 알러지때문에 늘 이 사려를 먹이는데 여기가 가격이 저렴해서 주문했어요. 이상보다 배송 빠르고 사료 개봉했을 때 냄새도 넘 고소한 것이 품질유지나 유통기한도 좋은 것 같더라고
댕댕이 알러지때문에 늘 이 사려를 먹이는데 여기가 가격이 저렴해서 주문했어요. 이상보다 배송 빠르고 사료 개봉했을 때 냄새도 넘 고소한 것이 품질유지나 유통기한도 좋은 것 같더라고요 품절만 아니라면 계속 여기에서 주문하고 싶어요"
